onset	duration	trial_type	trial_number	event_code	response_time	response	result
0.0	0	n/a	n/a	0	n/a	n/a	n/a
97.5641126002	n/a	n/a	fear	1	9.240747099975124	0	How much fear did you feel while breathing?
104.3782074	n/a	n/a	difficult	1	6.767573399934918	3	How difficult did it feel to breath?
113.695337	n/a	n/a	unpleasant	1	9.270488099893555	3	How unpleasant did it feel to breathe?
119.9930308	n/a	n/a	happy	1	6.2688847000245005	2	How happy or unhappy did you feel during loaded breathing?
128.1583137	n/a	n/a	calm	1	8.141213399823755	2	How calm or excited did you feel during loaded breathing?
134.2265293	n/a	n/a	anxiety	1	6.022279999917373	1	Please indicate how much anxiety you felt while breathing.
134.2391431	n/a	n/a	n/a	99	n/a	n/a	n/a
