onset	duration	trial_type	trial_number	event_code	response_time	response	result
0.0	0	n/a	n/a	0	n/a	n/a	n/a
104.3643764	n/a	n/a	fear	1	11.851220000069588	6	How much fear did you feel while breathing?
109.8627874	n/a	n/a	difficult	1	5.3916802001185715	7	How difficult did it feel to breath?
118.0118908	n/a	n/a	unpleasant	1	8.044443799648434	7	How unpleasant did it feel to breathe?
122.22668	n/a	n/a	happy	1	4.136066399980336	1	How happy or unhappy did you feel during loaded breathing?
127.377816	n/a	n/a	calm	1	5.088792799971998	2	How calm or excited did you feel during loaded breathing?
134.5914873	n/a	n/a	anxiety	1	7.111195000354201	7	Please indicate how much anxiety you felt while breathing.
134.6042011	n/a	n/a	n/a	99	n/a	n/a	n/a
