onset	duration	trial_type	trial_number	event_code	response_time	response	result
0.0	0	n/a	n/a	0	n/a	n/a	n/a
103.0612202	n/a	n/a	fear	1	7.259037200012244	7	How much fear did you feel while breathing?
109.5253333	n/a	n/a	difficult	1	6.361391999991611	7	How difficult did it feel to breath?
116.7087059	n/a	n/a	unpleasant	1	7.096184700028971	8	How unpleasant did it feel to breathe?
122.2409391	n/a	n/a	happy	1	5.477461399976164	0	How happy or unhappy did you feel during loaded breathing?
138.023387	n/a	n/a	calm	1	15.72466710000299	4	How calm or excited did you feel during loaded breathing?
143.8204158	n/a	n/a	anxiety	1	5.694925599964336	9	Please indicate how much anxiety you felt while breathing.
143.8330361	n/a	n/a	n/a	99	n/a	n/a	n/a
