onset	duration	trial_type	trial_number	event_code	response_time	response	result
0.0	0	n/a	n/a	0	n/a	n/a	n/a
96.2274061004	n/a	n/a	fear	1	8.351499900221825	3	How much fear did you feel while breathing?
101.9069966	n/a	n/a	difficult	1	5.572073299903423	4	How difficult did it feel to breath?
106.9419465	n/a	n/a	unpleasant	1	4.942261099815369	4	How unpleasant did it feel to breathe?
114.2068296	n/a	n/a	happy	1	7.214625199791044	2	How happy or unhappy did you feel during loaded breathing?
120.8213409	n/a	n/a	calm	1	6.560986299999058	3	How calm or excited did you feel during loaded breathing?
126.6707853	n/a	n/a	anxiety	1	5.754384400323033	4	Please indicate how much anxiety you felt while breathing.
126.6821997	n/a	n/a	n/a	99	n/a	n/a	n/a
