onset	duration	trial_type	trial_number	event_code	response_time	response	result
0.0	0	n/a	n/a	0	n/a	n/a	n/a
96.7956711	n/a	n/a	fear	1	9.917428200002178	7	How much fear did you feel while breathing?
103.7796339	n/a	n/a	difficult	1	6.937445500007016	9	How difficult did it feel to breath?
110.0115544	n/a	n/a	unpleasant	1	6.184182700002566	9	How unpleasant did it feel to breathe?
116.8606113	n/a	n/a	happy	1	6.821961800000281	2	How happy or unhappy did you feel during loaded breathing?
122.9594449	n/a	n/a	calm	1	6.075636499997927	3	How calm or excited did you feel during loaded breathing?
130.0594576	n/a	n/a	anxiety	1	7.050685700000031	8	Please indicate how much anxiety you felt while breathing.
130.0727114	n/a	n/a	n/a	99	n/a	n/a	n/a
