onset	duration	trial_type	trial_number	event_code	response_time	response	result
0.0	0	n/a	n/a	0	n/a	n/a	n/a
96.2827395	n/a	n/a	fear	1	8.730214600000181	10	How much fear did you feel while breathing?
104.147058	n/a	n/a	difficult	1	7.8173386999988	10	How difficult did it feel to breath?
111.3638334	n/a	n/a	unpleasant	1	7.169463500002166	10	How unpleasant did it feel to breathe?
119.9280362	n/a	n/a	happy	1	8.534277400001884	1	How happy or unhappy did you feel during loaded breathing?
126.7608994	n/a	n/a	calm	1	6.808956900000339	4	How calm or excited did you feel during loaded breathing?
134.9266811	n/a	n/a	anxiety	1	8.11881369999901	10	Please indicate how much anxiety you felt while breathing.
134.940306	n/a	n/a	n/a	99	n/a	n/a	n/a
