onset	duration	trial_type	trial_number	event_code	response_time	response	result
0.0	0	n/a	n/a	0	n/a	n/a	n/a
89.4597389002	n/a	n/a	fear	1	5.8338227001950145	4	How much fear did you feel while breathing?
96.6749527	n/a	n/a	difficult	1	7.1217060999479145	6	How difficult did it feel to breath?
102.8411355	n/a	n/a	unpleasant	1	6.066825599875301	6	How unpleasant did it feel to breathe?
108.3730614	n/a	n/a	happy	1	5.477042699931189	1	How happy or unhappy did you feel during loaded breathing?
114.4205597	n/a	n/a	calm	1	5.983256299979985	3	How calm or excited did you feel during loaded breathing?
124.2569884	n/a	n/a	anxiety	1	9.74199329991825	4	Please indicate how much anxiety you felt while breathing.
124.2669034	n/a	n/a	n/a	99	n/a	n/a	n/a
