onset	duration	trial_type	trial_number	event_code	response_time	response	result
0.0	0	n/a	n/a	0	n/a	n/a	n/a
99.232266	n/a	n/a	fear	1	9.718657699995674	6	How much fear did you feel while breathing?
105.3331483	n/a	n/a	difficult	1	6.000829099997645	6	How difficult did it feel to breath?
110.5129621	n/a	n/a	unpleasant	1	5.088112900004489	8	How unpleasant did it feel to breathe?
114.3627011	n/a	n/a	happy	1	3.798870300000999	0	How happy or unhappy did you feel during loaded breathing?
118.5621435	n/a	n/a	calm	1	4.155655500013381	3	How calm or excited did you feel during loaded breathing?
123.8947144	n/a	n/a	anxiety	1	5.2337315999902785	8	Please indicate how much anxiety you felt while breathing.
123.9081741	n/a	n/a	n/a	99	n/a	n/a	n/a
