onset	duration	trial_type	trial_number	event_code	response_time	response	result
0.0	0	n/a	n/a	0	n/a	n/a	n/a
94.2905485	n/a	n/a	fear	1	6.500498799956404	1	How much fear did you feel while breathing?
101.6557928	n/a	n/a	difficult	1	7.312565900036134	6	How difficult did it feel to breath?
107.0554487	n/a	n/a	unpleasant	1	5.345209899940528	6	How unpleasant did it feel to breathe?
110.2375101	n/a	n/a	happy	1	3.1528158000437543	2	How happy or unhappy did you feel during loaded breathing?
115.8700561	n/a	n/a	calm	1	5.604479700094089	2	How calm or excited did you feel during loaded breathing?
118.7371409	n/a	n/a	anxiety	1	2.8123748999787495	4	Please indicate how much anxiety you felt while breathing.
118.7504005	n/a	n/a	n/a	99	n/a	n/a	n/a
