onset	duration	trial_type	trial_number	event_code	response_time	response	result
0.0	0	n/a	n/a	0	n/a	n/a	n/a
95.8777310001	n/a	n/a	fear	1	9.893923999741673	5	How much fear did you feel while breathing?
102.9102184	n/a	n/a	difficult	1	6.970406799577177	7	How difficult did it feel to breath?
107.4751047	n/a	n/a	unpleasant	1	4.503913199994713	7	How unpleasant did it feel to breathe?
118.5405003	n/a	n/a	happy	1	11.033216499723494	2	How happy or unhappy did you feel during loaded breathing?
130.4385249	n/a	n/a	calm	1	11.866696799639612	3	How calm or excited did you feel during loaded breathing?
137.3050143	n/a	n/a	anxiety	1	6.798417500220239	6	Please indicate how much anxiety you felt while breathing.
137.3184197	n/a	n/a	n/a	99	n/a	n/a	n/a
