onset	duration	trial_type	trial_number	event_code	response_time	response	result
0.0	0	n/a	n/a	0	n/a	n/a	n/a
111.6534349	n/a	n/a	fear	1	7.009448099881411	1	How much fear did you feel while breathing?
118.35403	n/a	n/a	difficult	1	6.64712840016	2	How difficult did it feel to breath?
125.835082	n/a	n/a	unpleasant	1	7.428903399966657	2	How unpleasant did it feel to breathe?
135.6330052	n/a	n/a	happy	1	9.763947899919003	2	How happy or unhappy did you feel during loaded breathing?
143.4820764	n/a	n/a	calm	1	7.823194799944758	1	How calm or excited did you feel during loaded breathing?
150.5475799	n/a	n/a	anxiety	1	7.003593900008127	1	Please indicate how much anxiety you felt while breathing.
150.5626362	n/a	n/a	n/a	99	n/a	n/a	n/a
