onset	duration	trial_type	trial_number	event_code	response_time	response	result
0.0	0	n/a	n/a	0	n/a	n/a	n/a
96.0978939999	n/a	n/a	fear	1	7.7622592999832705	2	How much fear did you feel while breathing?
107.3118094	n/a	n/a	difficult	1	11.1630302000558	2	How difficult did it feel to breath?
117.0613193	n/a	n/a	unpleasant	1	9.698023100034334	3	How unpleasant did it feel to breathe?
125.1611315	n/a	n/a	happy	1	8.066384200006723	2	How happy or unhappy did you feel during loaded breathing?
131.2095032	n/a	n/a	calm	1	6.02301359991543	0	How calm or excited did you feel during loaded breathing?
140.5412013	n/a	n/a	anxiety	1	9.278287300025113	2	Please indicate how much anxiety you felt while breathing.
140.5546826	n/a	n/a	n/a	99	n/a	n/a	n/a
