onset	duration	trial_type	trial_number	event_code	response_time	response	result
0.0	0	n/a	n/a	0	n/a	n/a	n/a
96.7478893	n/a	n/a	fear	1	7.813980699982494	1	How much fear did you feel while breathing?
106.1306858	n/a	n/a	difficult	1	9.332337900064886	4	How difficult did it feel to breath?
111.3964903	n/a	n/a	unpleasant	1	5.215322699979879	2	How unpleasant did it feel to breathe?
117.1466857	n/a	n/a	happy	1	5.724077699938789	2	How happy or unhappy did you feel during loaded breathing?
123.5607294	n/a	n/a	calm	1	6.391397900064476	2	How calm or excited did you feel during loaded breathing?
130.2273571	n/a	n/a	anxiety	1	6.615282400045544	2	Please indicate how much anxiety you felt while breathing.
130.2409752	n/a	n/a	n/a	99	n/a	n/a	n/a
