onset	duration	trial_type	trial_number	event_code	response_time	response	result
0.0	0	n/a	n/a	0	n/a	n/a	n/a
92.9038252998	n/a	n/a	fear	1	6.185570199973881	3	How much fear did you feel while breathing?
98.2530450998	n/a	n/a	difficult	1	5.288486699806526	4	How difficult did it feel to breath?
103.485121	n/a	n/a	unpleasant	1	5.172401600051671	4	How unpleasant did it feel to breathe?
109.3506417	n/a	n/a	happy	1	5.832318500149995	2	How happy or unhappy did you feel during loaded breathing?
114.65036	n/a	n/a	calm	1	5.271959200035781	3	How calm or excited did you feel during loaded breathing?
121.1176091	n/a	n/a	anxiety	1	6.406788400141522	4	Please indicate how much anxiety you felt while breathing.
121.1299258	n/a	n/a	n/a	99	n/a	n/a	n/a
