onset	duration	trial_type	trial_number	event_code	response_time	response	result
0.0	0	n/a	n/a	0	n/a	n/a	n/a
66.1978415002	n/a	n/a	fear	1	4.973011000081897	6	How much fear did you feel while breathing?
71.4810114	n/a	n/a	difficult	1	5.219203199958429	7	How difficult did it feel to breath?
76.8965381002	n/a	n/a	unpleasant	1	5.351859000045806	7	How unpleasant did it feel to breathe?
82.2954212001	n/a	n/a	happy	1	5.363755299942568	2	How happy or unhappy did you feel during loaded breathing?
88.0440292002	n/a	n/a	calm	1	5.7193124000914395	3	How calm or excited did you feel during loaded breathing?
94.2271001001	n/a	n/a	anxiety	1	6.121022199979052	5	Please indicate how much anxiety you felt while breathing.
94.2405393	n/a	n/a	n/a	99	n/a	n/a	n/a
