onset	duration	trial_type	trial_number	event_code	response_time	response	result
0.0	0	n/a	n/a	0	n/a	n/a	n/a
95.6619239999	n/a	n/a	fear	1	6.2861115001142025	3	How much fear did you feel while breathing?
102.1458504	n/a	n/a	difficult	1	6.418610000051558	5	How difficult did it feel to breath?
106.7456446	n/a	n/a	unpleasant	1	4.536540099885315	6	How unpleasant did it feel to breathe?
113.1928551	n/a	n/a	happy	1	6.40974329970777	1	How happy or unhappy did you feel during loaded breathing?
121.9596784	n/a	n/a	calm	1	8.737586400005966	3	How calm or excited did you feel during loaded breathing?
129.5087974	n/a	n/a	anxiety	1	7.4819728997536	3	Please indicate how much anxiety you felt while breathing.
129.5218854	n/a	n/a	n/a	99	n/a	n/a	n/a
