onset	duration	trial_type	trial_number	event_code	response_time	response	result
0.0	0	n/a	n/a	0	n/a	n/a	n/a
104.2112695	n/a	n/a	fear	1	13.556110399775207	1	How much fear did you feel while breathing?
112.8606911	n/a	n/a	difficult	1	8.600677800364792	2	How difficult did it feel to breath?
122.677174	n/a	n/a	unpleasant	1	9.768517100252211	2	How unpleasant did it feel to breathe?
136.8894366	n/a	n/a	happy	1	14.182520699687302	2	How happy or unhappy did you feel during loaded breathing?
145.9065004	n/a	n/a	calm	1	8.992350700311363	1	How calm or excited did you feel during loaded breathing?
161.8199735	n/a	n/a	anxiety	1	15.862993400543928	1	Please indicate how much anxiety you felt while breathing.
161.8345597	n/a	n/a	n/a	99	n/a	n/a	n/a
