onset	duration	trial_type	trial_number	event_code	response_time	response	result
0.0	0	n/a	n/a	0	n/a	n/a	n/a
92.2531946001	n/a	n/a	fear	1	7.605170600116253	3	How much fear did you feel while breathing?
99.687283	n/a	n/a	difficult	1	7.389332499820739	4	How difficult did it feel to breath?
105.6849796	n/a	n/a	unpleasant	1	5.951138800010085	3	How unpleasant did it feel to breathe?
112.5011368	n/a	n/a	happy	1	6.786472599953413	1	How happy or unhappy did you feel during loaded breathing?
120.0998463	n/a	n/a	calm	1	7.575400399975479	1	How calm or excited did you feel during loaded breathing?
128.0149952	n/a	n/a	anxiety	1	7.869538600090891	3	Please indicate how much anxiety you felt while breathing.
128.0295732	n/a	n/a	n/a	99	n/a	n/a	n/a
