onset	duration	trial_type	trial_number	event_code	response_time	response	result
0.0	0	n/a	n/a	0	n/a	n/a	n/a
89.5891676999	n/a	n/a	fear	1	7.704078699927777	3	How much fear did you feel while breathing?
96.6215731001	n/a	n/a	difficult	1	6.984756200108677	4	How difficult did it feel to breath?
104.4709523	n/a	n/a	unpleasant	1	7.8030600000638515	4	How unpleasant did it feel to breathe?
112.4195955	n/a	n/a	happy	1	7.922320599900559	1	How happy or unhappy did you feel during loaded breathing?
119.3849914	n/a	n/a	calm	1	6.940432999981567	2	How calm or excited did you feel during loaded breathing?
127.0503329	n/a	n/a	anxiety	1	7.616878900211304	3	Please indicate how much anxiety you felt while breathing.
127.0641222	n/a	n/a	n/a	99	n/a	n/a	n/a
