onset	duration	trial_type	trial_number	event_code	response_time	response	result
0.0	0	n/a	n/a	0	n/a	n/a	n/a
92.9605413	n/a	n/a	fear	1	6.329888600157574	3	How much fear did you feel while breathing?
98.0097224	n/a	n/a	difficult	1	5.003434200072661	5	How difficult did it feel to breath?
103.4893687	n/a	n/a	unpleasant	1	5.432495899964124	5	How unpleasant did it feel to breathe?
110.1573157	n/a	n/a	happy	1	6.640210599871352	1	How happy or unhappy did you feel during loaded breathing?
117.6222017	n/a	n/a	calm	1	7.440392700023949	2	How calm or excited did you feel during loaded breathing?
123.4379652	n/a	n/a	anxiety	1	5.768249300075695	5	Please indicate how much anxiety you felt while breathing.
123.4518433	n/a	n/a	n/a	99	n/a	n/a	n/a
