onset	duration	trial_type	trial_number	event_code	response_time	response	result
0.0	0	n/a	n/a	0	n/a	n/a	n/a
81.5772692002	n/a	n/a	fear	1	4.836036399938166	0	How much fear did you feel while breathing?
89.7414841	n/a	n/a	difficult	1	8.12012099986896	2	How difficult did it feel to breath?
96.3413881003	n/a	n/a	unpleasant	1	6.55460420018062	1	How unpleasant did it feel to breathe?
99.7238503001	n/a	n/a	happy	1	3.351455600000918	2	How happy or unhappy did you feel during loaded breathing?
103.2731564	n/a	n/a	calm	1	3.526908800005913	2	How calm or excited did you feel during loaded breathing?
109.0069789	n/a	n/a	anxiety	1	5.689130099955946	0	Please indicate how much anxiety you felt while breathing.
109.0193371	n/a	n/a	n/a	99	n/a	n/a	n/a
