onset	duration	trial_type	trial_number	event_code	response_time	response	result
0.0	0	n/a	n/a	0	n/a	n/a	n/a
87.1929503996	n/a	n/a	fear	1	6.074471100233495	4	How much fear did you feel while breathing?
92.9599046996	n/a	n/a	difficult	1	5.718050999566913	8	How difficult did it feel to breath?
97.7741056997	n/a	n/a	unpleasant	1	4.7625088999047875	7	How unpleasant did it feel to breathe?
104.2903521	n/a	n/a	happy	1	6.483077599667013	2	How happy or unhappy did you feel during loaded breathing?
110.4557695	n/a	n/a	calm	1	6.1400435995310545	2	How calm or excited did you feel during loaded breathing?
116.0721397	n/a	n/a	anxiety	1	5.563058700412512	2	Please indicate how much anxiety you felt while breathing.
116.0860791	n/a	n/a	n/a	99	n/a	n/a	n/a
