onset	duration	trial_type	trial_number	event_code	response_time	response	result
0.0	0	n/a	n/a	0	n/a	n/a	n/a
86.7918381002	n/a	n/a	fear	1	5.933031899854541	6	How much fear did you feel while breathing?
91.7748637004	n/a	n/a	difficult	1	4.933206100016832	8	How difficult did it feel to breath?
96.1403286001	n/a	n/a	unpleasant	1	4.311722899787128	7	How unpleasant did it feel to breathe?
100.9721767	n/a	n/a	happy	1	4.800425699912012	1	How happy or unhappy did you feel during loaded breathing?
106.071944	n/a	n/a	calm	1	5.074357399716973	2	How calm or excited did you feel during loaded breathing?
110.9721592	n/a	n/a	anxiety	1	4.851038800552487	3	Please indicate how much anxiety you felt while breathing.
110.9852822	n/a	n/a	n/a	99	n/a	n/a	n/a
