onset	duration	trial_type	trial_number	event_code	response_time	response	result
0.0	0	n/a	n/a	0	n/a	n/a	n/a
93.6876578	n/a	n/a	fear	1	7.470404100022279	0	How much fear did you feel while breathing?
100.6034712	n/a	n/a	difficult	1	6.8145446999697015	2	How difficult did it feel to breath?
112.6517336	n/a	n/a	unpleasant	1	11.953323199995793	3	How unpleasant did it feel to breathe?
120.5501739	n/a	n/a	happy	1	7.83839079993777	2	How happy or unhappy did you feel during loaded breathing?
126.4987684	n/a	n/a	calm	1	5.879808099940419	1	How calm or excited did you feel during loaded breathing?
132.1317821	n/a	n/a	anxiety	1	5.5441648999694735	1	Please indicate how much anxiety you felt while breathing.
132.1440702	n/a	n/a	n/a	99	n/a	n/a	n/a
