onset	duration	trial_type	trial_number	event_code	response_time	response	result
0.0	0	n/a	n/a	0	n/a	n/a	n/a
102.4040544	n/a	n/a	fear	1	11.200241399928927	1	How much fear did you feel while breathing?
112.2020386	n/a	n/a	difficult	1	9.696701899985783	5	How difficult did it feel to breath?
120.6028056	n/a	n/a	unpleasant	1	8.301433600019664	5	How unpleasant did it feel to breathe?
131.3164149	n/a	n/a	happy	1	10.650504400022328	1	How happy or unhappy did you feel during loaded breathing?
138.0335894	n/a	n/a	calm	1	6.653552400064655	2	How calm or excited did you feel during loaded breathing?
145.8811009	n/a	n/a	anxiety	1	7.737436300027184	3	Please indicate how much anxiety you felt while breathing.
145.8935241	n/a	n/a	n/a	99	n/a	n/a	n/a
