onset	duration	trial_type	trial_number	event_code	response_time	response	result
0.0	0	n/a	n/a	0	n/a	n/a	n/a
96.6339739	n/a	n/a	fear	1	9.846492199925706	2	How much fear did you feel while breathing?
105.1342796	n/a	n/a	difficult	1	8.37582570000086	7	How difficult did it feel to breath?
114.9336752	n/a	n/a	unpleasant	1	9.673135199933313	8	How unpleasant did it feel to breathe?
125.5466673	n/a	n/a	happy	1	10.562131899991073	0	How happy or unhappy did you feel during loaded breathing?
134.8650746	n/a	n/a	calm	1	9.267353400005959	2	How calm or excited did you feel during loaded breathing?
144.6631693	n/a	n/a	anxiety	1	9.692454000003636	4	Please indicate how much anxiety you felt while breathing.
144.6744266	n/a	n/a	n/a	99	n/a	n/a	n/a
