onset	duration	trial_type	trial_number	event_code	response_time	response	result
0.0	0	n/a	n/a	0	n/a	n/a	n/a
104.2766009	n/a	n/a	fear	1	8.695989200030454	0	How much fear did you feel while breathing?
115.2583699	n/a	n/a	difficult	1	10.889168000081554	4	How difficult did it feel to breath?
120.4753056	n/a	n/a	unpleasant	1	5.124098100000992	3	How unpleasant did it feel to breathe?
126.939498	n/a	n/a	happy	1	6.39475739991758	2	How happy or unhappy did you feel during loaded breathing?
132.9407322	n/a	n/a	calm	1	5.956036900053732	1	How calm or excited did you feel during loaded breathing?
141.2395641	n/a	n/a	anxiety	1	8.201165699982084	1	Please indicate how much anxiety you felt while breathing.
141.2507922	n/a	n/a	n/a	99	n/a	n/a	n/a
