onset	duration	trial_type	trial_number	event_code	response_time	response	result
0.0	0	n/a	n/a	0	n/a	n/a	n/a
100.5116067	n/a	n/a	fear	1	9.142280200030655	1	How much fear did you feel while breathing?
106.9093838	n/a	n/a	difficult	1	6.282539099920541	4	How difficult did it feel to breath?
113.1743744	n/a	n/a	unpleasant	1	6.177586500067264	3	How unpleasant did it feel to breathe?
119.5728834	n/a	n/a	happy	1	6.328148299828172	3	How happy or unhappy did you feel during loaded breathing?
127.055755	n/a	n/a	calm	1	7.4265368999913335	0	How calm or excited did you feel during loaded breathing?
136.3388144	n/a	n/a	anxiety	1	9.188416799996048	2	Please indicate how much anxiety you felt while breathing.
136.3494792	n/a	n/a	n/a	99	n/a	n/a	n/a
