onset	duration	trial_type	trial_number	event_code	response_time	response	result
0.0	0	n/a	n/a	0	n/a	n/a	n/a
108.1936195	n/a	n/a	fear	1	8.45143900020048	0	How much fear did you feel while breathing?
116.2419805	n/a	n/a	difficult	1	7.95428270008415	3	How difficult did it feel to breath?
123.7746659	n/a	n/a	unpleasant	1	7.4440807001665235	2	How unpleasant did it feel to breathe?
133.558058	n/a	n/a	happy	1	9.724133699666709	3	How happy or unhappy did you feel during loaded breathing?
141.7065743	n/a	n/a	calm	1	8.096336099784821	0	How calm or excited did you feel during loaded breathing?
150.437329	n/a	n/a	anxiety	1	8.62123249983415	2	Please indicate how much anxiety you felt while breathing.
150.4500156	n/a	n/a	n/a	99	n/a	n/a	n/a
