onset	duration	trial_type	trial_number	event_code	response_time	response	result
0.0	0	n/a	n/a	0	n/a	n/a	n/a
96.8643348	n/a	n/a	fear	1	9.428591299976688	2	How much fear did you feel while breathing?
104.9141358	n/a	n/a	difficult	1	7.99875400000019	3	How difficult did it feel to breath?
112.5460601	n/a	n/a	unpleasant	1	7.582771999994293	3	How unpleasant did it feel to breathe?
119.4274082	n/a	n/a	happy	1	6.850475299987011	2	How happy or unhappy did you feel during loaded breathing?
126.2102339	n/a	n/a	calm	1	6.756095000018831	2	How calm or excited did you feel during loaded breathing?
133.8592519	n/a	n/a	anxiety	1	7.600480200024322	4	Please indicate how much anxiety you felt while breathing.
133.8727581	n/a	n/a	n/a	99	n/a	n/a	n/a
