onset	duration	trial_type	trial_number	event_code	response_time	response	result
0.0	0	n/a	n/a	0	n/a	n/a	n/a
88.0217758999	n/a	n/a	fear	1	5.026989900041372	0	How much fear did you feel while breathing?
93.5342200999	n/a	n/a	difficult	1	5.468220400158316	0	How difficult did it feel to breath?
97.3809676999	n/a	n/a	unpleasant	1	3.8010816001333296	0	How unpleasant did it feel to breathe?
102.1979541	n/a	n/a	happy	1	4.790436600334942	2	How happy or unhappy did you feel during loaded breathing?
104.9125465	n/a	n/a	calm	1	2.6904506999999285	0	How calm or excited did you feel during loaded breathing?
108.4476004	n/a	n/a	anxiety	1	3.491526400204748	0	Please indicate how much anxiety you felt while breathing.
108.4607076	n/a	n/a	n/a	99	n/a	n/a	n/a
