onset	duration	trial_type	trial_number	event_code	response_time	response	result
0.0	0	n/a	n/a	0	n/a	n/a	n/a
84.9979065999	n/a	n/a	fear	1	5.70547190005891	5	How much fear did you feel while breathing?
88.6326191998	n/a	n/a	difficult	1	3.5861949999816716	7	How difficult did it feel to breath?
91.9660240998	n/a	n/a	unpleasant	1	3.2893186998553574	7	How unpleasant did it feel to breathe?
94.3819499	n/a	n/a	happy	1	2.3903304000850767	1	How happy or unhappy did you feel during loaded breathing?
96.482082	n/a	n/a	calm	1	2.076999600045383	2	How calm or excited did you feel during loaded breathing?
98.8975694999	n/a	n/a	anxiety	1	2.3692290999460965	7	Please indicate how much anxiety you felt while breathing.
98.9108976999	n/a	n/a	n/a	99	n/a	n/a	n/a
