onset	duration	trial_type	trial_number	event_code	response_time	response	result
0.0	0	n/a	n/a	0	n/a	n/a	n/a
94.0632353001	n/a	n/a	fear	1	6.285665400093421	0	How much fear did you feel while breathing?
100.3273453	n/a	n/a	difficult	1	6.168444199953228	4	How difficult did it feel to breath?
105.1464621	n/a	n/a	unpleasant	1	4.728103799978271	3	How unpleasant did it feel to breathe?
113.044211	n/a	n/a	happy	1	7.850113699911162	2	How happy or unhappy did you feel during loaded breathing?
117.9613158	n/a	n/a	calm	1	4.85390489990823	1	How calm or excited did you feel during loaded breathing?
124.9260853	n/a	n/a	anxiety	1	6.866589899873361	1	Please indicate how much anxiety you felt while breathing.
124.9375037	n/a	n/a	n/a	99	n/a	n/a	n/a
