onset	duration	trial_type	trial_number	event_code	response_time	response	result
0.0	0	n/a	n/a	0	n/a	n/a	n/a
95.1256964002	n/a	n/a	fear	1	12.489173200214282	6	How much fear did you feel while breathing?
104.2599563	n/a	n/a	difficult	1	9.034530199831352	10	How difficult did it feel to breath?
112.7085121	n/a	n/a	unpleasant	1	8.3612904001493	8	How unpleasant did it feel to breathe?
119.7903887	n/a	n/a	happy	1	7.029670499963686	0	How happy or unhappy did you feel during loaded breathing?
124.8722326	n/a	n/a	calm	1	5.017566900001839	2	How calm or excited did you feel during loaded breathing?
131.6902598	n/a	n/a	anxiety	1	6.736021799966693	4	Please indicate how much anxiety you felt while breathing.
131.7007492	n/a	n/a	n/a	99	n/a	n/a	n/a
