onset	duration	trial_type	trial_number	event_code	response_time	response	result
0.0	0	n/a	n/a	0	n/a	n/a	n/a
93.3382506995	n/a	n/a	fear	1	5.971071999520063	0	How much fear did you feel while breathing?
101.954402099	n/a	n/a	difficult	1	8.567421999759972	1	How difficult did it feel to breath?
108.7540612	n/a	n/a	unpleasant	1	6.746519000269473	2	How unpleasant did it feel to breathe?
116.3509735	n/a	n/a	happy	1	7.564786300063133	2	How happy or unhappy did you feel during loaded breathing?
122.751183299	n/a	n/a	calm	1	6.374694099649787	1	How calm or excited did you feel during loaded breathing?
129.900164899	n/a	n/a	anxiety	1	7.0962127996608615	1	Please indicate how much anxiety you felt while breathing.
129.9140693	n/a	n/a	n/a	99	n/a	n/a	n/a
