onset	duration	trial_type	trial_number	event_code	response_time	response	result
0.0	0	n/a	n/a	0	n/a	n/a	n/a
90.0209800005	n/a	n/a	fear	1	5.578358500264585	0	How much fear did you feel while breathing?
95.7535939002	n/a	n/a	difficult	1	5.682368200272322	4	How difficult did it feel to breath?
100.6206789	n/a	n/a	unpleasant	1	4.817971399985254	5	How unpleasant did it feel to breathe?
106.5192484	n/a	n/a	happy	1	5.864939499646425	2	How happy or unhappy did you feel during loaded breathing?
112.4504632	n/a	n/a	calm	1	5.905168199911714	1	How calm or excited did you feel during loaded breathing?
119.6995839	n/a	n/a	anxiety	1	7.197644899599254	2	Please indicate how much anxiety you felt while breathing.
119.7146795	n/a	n/a	n/a	99	n/a	n/a	n/a
