onset	duration	trial_type	trial_number	event_code	response_time	response	result
0.0	0	n/a	n/a	0	n/a	n/a	n/a
96.7394866003	n/a	n/a	fear	1	6.709250899963081	0	How much fear did you feel while breathing?
105.1050027	n/a	n/a	difficult	1	8.316468300297856	1	How difficult did it feel to breath?
111.9042774	n/a	n/a	unpleasant	1	6.750202899798751	0	How unpleasant did it feel to breathe?
120.752391201	n/a	n/a	happy	1	8.816964900121093	2	How happy or unhappy did you feel during loaded breathing?
129.7850505	n/a	n/a	calm	1	9.009422999806702	1	How calm or excited did you feel during loaded breathing?
137.384090601	n/a	n/a	anxiety	1	7.54914400074631	0	Please indicate how much anxiety you felt while breathing.
137.3978748	n/a	n/a	n/a	99	n/a	n/a	n/a
