onset	duration	trial_type	trial_number	event_code	response_time	response	result
0.0	0	n/a	n/a	0	n/a	n/a	n/a
86.0007396	n/a	n/a	fear	1	5.845435399998678	4	How much fear did you feel while breathing?
91.5333488	n/a	n/a	difficult	1	5.485311000000365	10	How difficult did it feel to breath?
98.2486493	n/a	n/a	unpleasant	1	6.666324499998154	7	How unpleasant did it feel to breathe?
104.6979802	n/a	n/a	happy	1	6.420971700001246	1	How happy or unhappy did you feel during loaded breathing?
112.0307528	n/a	n/a	calm	1	7.310926500002097	2	How calm or excited did you feel during loaded breathing?
119.6957445	n/a	n/a	anxiety	1	7.6139794000009715	5	Please indicate how much anxiety you felt while breathing.
119.7100753	n/a	n/a	n/a	99	n/a	n/a	n/a
