onset	duration	trial_type	trial_number	event_code	response_time	response	result
0.0	0	n/a	n/a	0	n/a	n/a	n/a
208.8661717	n/a	n/a	fear	1	6.57508450000023	2	How much fear did you feel while breathing?
216.3322274	n/a	n/a	difficult	1	7.4133518999988155	8	How difficult did it feel to breath?
222.9318531	n/a	n/a	unpleasant	1	6.549467799999547	6	How unpleasant did it feel to breathe?
229.4300941	n/a	n/a	happy	1	6.465232400001696	2	How happy or unhappy did you feel during loaded breathing?
235.4793559	n/a	n/a	calm	1	6.027459799999633	2	How calm or excited did you feel during loaded breathing?
242.7290586	n/a	n/a	anxiety	1	7.200467999999091	3	Please indicate how much anxiety you felt while breathing.
242.7428343	n/a	n/a	n/a	99	n/a	n/a	n/a
