onset	duration	trial_type	trial_number	event_code	response_time	response	result
0.0	0	n/a	n/a	0	n/a	n/a	n/a
110.8743375	n/a	n/a	fear	1	15.906707699410617	4	How much fear did you feel while breathing?
118.674328201	n/a	n/a	difficult	1	7.753984699957073	6	How difficult did it feel to breath?
136.037280301	n/a	n/a	unpleasant	1	17.3165499009192	7	How unpleasant did it feel to breathe?
143.8874584	n/a	n/a	happy	1	7.820763799361885	2	How happy or unhappy did you feel during loaded breathing?
156.3522442	n/a	n/a	calm	1	12.439780999906361	2	How calm or excited did you feel during loaded breathing?
167.4681327	n/a	n/a	anxiety	1	11.067841799929738	6	Please indicate how much anxiety you felt while breathing.
167.4816697	n/a	n/a	n/a	99	n/a	n/a	n/a
