onset	duration	trial_type	trial_number	event_code	response_time	response	result
0.0	0	n/a	n/a	0	n/a	n/a	n/a
99.4628364	n/a	n/a	fear	1	14.4617129	3	How much fear did you feel while breathing?
103.6287258	n/a	n/a	difficult	1	4.1196517	9	How difficult did it feel to breath?
124.9268419	n/a	n/a	unpleasant	1	21.2544262	7	How unpleasant did it feel to breathe?
138.5735965	n/a	n/a	happy	1	13.6176029	1	How happy or unhappy did you feel during loaded breathing?
148.4394165	n/a	n/a	calm	1	9.8417137	2	How calm or excited did you feel during loaded breathing?
155.7054428	n/a	n/a	anxiety	1	7.2180434	7	Please indicate how much anxiety you felt while breathing.
155.7198913	n/a	n/a	n/a	99	n/a	n/a	n/a
