onset	duration	trial_type	trial_number	event_code	response_time	response	result
0.0	0	n/a	n/a	0	n/a	n/a	n/a
100.5950193	n/a	n/a	fear	1	8.912239000201225	5	How much fear did you feel while breathing?
107.961494099	n/a	n/a	difficult	1	7.314403399825096	6	How difficult did it feel to breath?
115.2934703	n/a	n/a	unpleasant	1	7.279798599891365	7	How unpleasant did it feel to breathe?
123.0762982	n/a	n/a	happy	1	7.7511077001690865	1	How happy or unhappy did you feel during loaded breathing?
130.9912372	n/a	n/a	calm	1	7.886528400704265	1	How calm or excited did you feel during loaded breathing?
139.47426	n/a	n/a	anxiety	1	8.431631200015545	6	Please indicate how much anxiety you felt while breathing.
139.4883804	n/a	n/a	n/a	99	n/a	n/a	n/a
