onset	duration	trial_type	trial_number	event_code	response_time	response	result
0.0	0	n/a	n/a	0	n/a	n/a	n/a
91.9651777	n/a	n/a	fear	1	6.549710299994331	0	How much fear did you feel while breathing?
97.3307479	n/a	n/a	difficult	1	5.302183900028467	5	How difficult did it feel to breath?
101.5648958	n/a	n/a	unpleasant	1	4.169329199998174	4	How unpleasant did it feel to breathe?
107.4461681	n/a	n/a	happy	1	5.845766999991611	1	How happy or unhappy did you feel during loaded breathing?
113.1793185	n/a	n/a	calm	1	5.703762899967842	1	How calm or excited did you feel during loaded breathing?
120.2607706	n/a	n/a	anxiety	1	7.0169403000036255	1	Please indicate how much anxiety you felt while breathing.
120.2760964	n/a	n/a	n/a	99	n/a	n/a	n/a
