onset	duration	trial_type	trial_number	event_code	response_time	response	result
0.0	0	n/a	n/a	0	n/a	n/a	n/a
96.6766427	n/a	n/a	fear	1	12.078255200060084	3	How much fear did you feel while breathing?
101.2912013	n/a	n/a	difficult	1	4.511750999954529	4	How difficult did it feel to breath?
111.3382035	n/a	n/a	unpleasant	1	9.95868290006183	4	How unpleasant did it feel to breathe?
116.8719684	n/a	n/a	happy	1	5.487475199974142	1	How happy or unhappy did you feel during loaded breathing?
124.3056546	n/a	n/a	calm	1	7.386564600048587	1	How calm or excited did you feel during loaded breathing?
131.0717387	n/a	n/a	anxiety	1	6.667523700045422	3	Please indicate how much anxiety you felt while breathing.
131.0830098	n/a	n/a	n/a	99	n/a	n/a	n/a
