onset	duration	trial_type	trial_number	event_code	response_time	response	result
0.0	0	n/a	n/a	0	n/a	n/a	n/a
85.890425	n/a	n/a	fear	1	8.37257360003423	0	How much fear did you feel while breathing?
97.7905717	n/a	n/a	difficult	1	11.85302809998393	1	How difficult did it feel to breath?
105.4731027	n/a	n/a	unpleasant	1	7.635223199962638	1	How unpleasant did it feel to breathe?
115.1205861	n/a	n/a	happy	1	9.619131300016306	4	How happy or unhappy did you feel during loaded breathing?
119.6203455	n/a	n/a	calm	1	4.476559600094333	0	How calm or excited did you feel during loaded breathing?
126.2852162	n/a	n/a	anxiety	1	6.616941599990241	0	Please indicate how much anxiety you felt while breathing.
126.2988464	n/a	n/a	n/a	99	n/a	n/a	n/a
