onset	duration	trial_type	trial_number	event_code	response_time	response	result
0.0	0	n/a	n/a	0	n/a	n/a	n/a
83.3345438	n/a	n/a	fear	1	4.506753999739885	1	How much fear did you feel while breathing?
88.1160884001	n/a	n/a	difficult	1	4.706592299975455	8	How difficult did it feel to breath?
93.8496682001	n/a	n/a	unpleasant	1	5.681492900010198	6	How unpleasant did it feel to breathe?
97.7483434002	n/a	n/a	happy	1	3.8632404999807477	2	How happy or unhappy did you feel during loaded breathing?
101.9468949	n/a	n/a	calm	1	4.172505799680948	0	How calm or excited did you feel during loaded breathing?
105.0301441	n/a	n/a	anxiety	1	3.0254796999506652	1	Please indicate how much anxiety you felt while breathing.
105.044534	n/a	n/a	n/a	99	n/a	n/a	n/a
