onset	duration	trial_type	trial_number	event_code	response_time	response	result
0.0	0	n/a	n/a	0	n/a	n/a	n/a
83.1512172995	n/a	n/a	fear	1	3.461314299143851	3	How much fear did you feel while breathing?
90.3334096	n/a	n/a	difficult	1	7.13982139993459	5	How difficult did it feel to breath?
93.6832972001	n/a	n/a	unpleasant	1	3.3073797998949885	5	How unpleasant did it feel to breathe?
96.0159139996	n/a	n/a	happy	1	2.3050804995000362	1	How happy or unhappy did you feel during loaded breathing?
99.0985957002	n/a	n/a	calm	1	3.0610789004713297	1	How calm or excited did you feel during loaded breathing?
104.7151097	n/a	n/a	anxiety	1	5.5697057005018	6	Please indicate how much anxiety you felt while breathing.
104.7300467	n/a	n/a	n/a	99	n/a	n/a	n/a
