onset	duration	trial_type	trial_number	event_code	response_time	response	result
0.0	0	n/a	n/a	0	n/a	n/a	n/a
92.8677913002	n/a	n/a	fear	1	4.92618909990415	4	How much fear did you feel while breathing?
96.6014268002	n/a	n/a	difficult	1	3.6836264999583364	8	How difficult did it feel to breath?
100.2658197	n/a	n/a	unpleasant	1	3.6161123998463154	8	How unpleasant did it feel to breathe?
105.5658505	n/a	n/a	happy	1	5.272577399853617	1	How happy or unhappy did you feel during loaded breathing?
107.7159167	n/a	n/a	calm	1	2.126544900238514	2	How calm or excited did you feel during loaded breathing?
110.9489993	n/a	n/a	anxiety	1	3.1808094000443816	7	Please indicate how much anxiety you felt while breathing.
110.962	n/a	n/a	n/a	99	n/a	n/a	n/a
