onset	duration	trial_type	trial_number	event_code	response_time	response	result
0.0	0	n/a	n/a	0	n/a	n/a	n/a
88.3012783	n/a	n/a	fear	1	3.9930780999999342	0	How much fear did you feel while breathing?
91.7352965	n/a	n/a	difficult	1	3.389925700000049	0	How difficult did it feel to breath?
94.5677762	n/a	n/a	unpleasant	1	2.7852292000000034	0	How unpleasant did it feel to breathe?
98.8329739	n/a	n/a	happy	1	4.240580600000044	1	How happy or unhappy did you feel during loaded breathing?
105.582206	n/a	n/a	calm	1	6.726421500000015	2	How calm or excited did you feel during loaded breathing?
110.3654191	n/a	n/a	anxiety	1	4.734305599999971	0	Please indicate how much anxiety you felt while breathing.
110.3788358	n/a	n/a	n/a	99	n/a	n/a	n/a
