onset	duration	trial_type	trial_number	event_code	response_time	response	result
0.0	0	n/a	n/a	0	n/a	n/a	n/a
89.0078845001	n/a	n/a	fear	1	5.086424099979922	1	How much fear did you feel while breathing?
93.0053977	n/a	n/a	difficult	1	3.950194099918008	4	How difficult did it feel to breath?
100.7039801	n/a	n/a	unpleasant	1	7.651783499983139	3	How unpleasant did it feel to breathe?
105.1545975	n/a	n/a	happy	1	4.423374699894339	2	How happy or unhappy did you feel during loaded breathing?
110.3373253	n/a	n/a	calm	1	5.1591904000379145	1	How calm or excited did you feel during loaded breathing?
115.0033581	n/a	n/a	anxiety	1	4.616805199999362	0	Please indicate how much anxiety you felt while breathing.
115.0160005	n/a	n/a	n/a	99	n/a	n/a	n/a
