onset	duration	trial_type	trial_number	event_code	response_time	response	result
0.0	0	n/a	n/a	0	n/a	n/a	n/a
91.7158622	n/a	n/a	fear	1	6.272607499966398	0	How much fear did you feel while breathing?
98.882398	n/a	n/a	difficult	1	7.11763799993787	1	How difficult did it feel to breath?
104.8816426	n/a	n/a	unpleasant	1	5.951683100080118	1	How unpleasant did it feel to breathe?
111.9639399	n/a	n/a	happy	1	7.050555599969812	2	How happy or unhappy did you feel during loaded breathing?
117.4968055	n/a	n/a	calm	1	5.510985099943355	0	How calm or excited did you feel during loaded breathing?
122.6797949	n/a	n/a	anxiety	1	5.1325872000306845	0	Please indicate how much anxiety you felt while breathing.
122.6924734	n/a	n/a	n/a	99	n/a	n/a	n/a
