onset	duration	trial_type	trial_number	event_code	response_time	response	result
0.0	0	n/a	n/a	0	n/a	n/a	n/a
93.8721248	n/a	n/a	fear	1	7.202443800008041	2	How much fear did you feel while breathing?
98.9881996	n/a	n/a	difficult	1	5.068518400003086	4	How difficult did it feel to breath?
103.3212551	n/a	n/a	unpleasant	1	4.289908100006869	4	How unpleasant did it feel to breathe?
110.5190866	n/a	n/a	happy	1	7.169909899996128	2	How happy or unhappy did you feel during loaded breathing?
117.0350465	n/a	n/a	calm	1	6.492057300012675	2	How calm or excited did you feel during loaded breathing?
125.9865363	n/a	n/a	anxiety	1	8.904629399999976	5	Please indicate how much anxiety you felt while breathing.
125.9988749	n/a	n/a	n/a	99	n/a	n/a	n/a
