onset	duration	trial_type	trial_number	event_code	response_time	response	result
0.0	0	n/a	n/a	0	n/a	n/a	n/a
98.7888988	n/a	n/a	fear	1	8.477020799997263	2	How much fear did you feel while breathing?
106.3706094	n/a	n/a	difficult	1	7.534656499992707	6	How difficult did it feel to breath?
114.2519214	n/a	n/a	unpleasant	1	7.83355899999151	5	How unpleasant did it feel to breathe?
122.2848355	n/a	n/a	happy	1	8.002610499999719	2	How happy or unhappy did you feel during loaded breathing?
129.6843046	n/a	n/a	calm	1	7.375672399997711	2	How calm or excited did you feel during loaded breathing?
136.1160837	n/a	n/a	anxiety	1	6.3845929999952205	4	Please indicate how much anxiety you felt while breathing.
136.1299219	n/a	n/a	n/a	99	n/a	n/a	n/a
