onset	duration	trial_type	trial_number	event_code	response_time	response	result
0.0	0	n/a	n/a	0	n/a	n/a	n/a
96.5979045	n/a	n/a	fear	1	5.29540529998485	6	How much fear did you feel while breathing?
100.681867	n/a	n/a	difficult	1	4.0351896999636665	5	How difficult did it feel to breath?
107.0138111	n/a	n/a	unpleasant	1	6.285455700010061	5	How unpleasant did it feel to breathe?
112.2958453	n/a	n/a	happy	1	5.2551790999714285	1	How happy or unhappy did you feel during loaded breathing?
117.0624136	n/a	n/a	calm	1	4.743949899915606	2	How calm or excited did you feel during loaded breathing?
122.1955723	n/a	n/a	anxiety	1	5.08283880003728	6	Please indicate how much anxiety you felt while breathing.
122.2093231	n/a	n/a	n/a	99	n/a	n/a	n/a
