onset	duration	trial_type	trial_number	event_code	response_time	response	result
0.0	0	n/a	n/a	0	n/a	n/a	n/a
95.9656044	n/a	n/a	fear	1	7.878511400078423	3	How much fear did you feel while breathing?
101.314662	n/a	n/a	difficult	1	5.298858299967833	3	How difficult did it feel to breath?
106.2471025	n/a	n/a	unpleasant	1	4.882351299980655	2	How unpleasant did it feel to breathe?
112.995577	n/a	n/a	happy	1	6.717866700026207	2	How happy or unhappy did you feel during loaded breathing?
119.1120976	n/a	n/a	calm	1	6.093213799991645	2	How calm or excited did you feel during loaded breathing?
126.6445566	n/a	n/a	anxiety	1	7.482441600062884	4	Please indicate how much anxiety you felt while breathing.
126.657995	n/a	n/a	n/a	99	n/a	n/a	n/a
