onset	duration	trial_type	trial_number	event_code	response_time	response	result
0.0	0	n/a	n/a	0	n/a	n/a	n/a
81.5642068004	n/a	n/a	fear	1	6.220304400660098	10	How much fear did you feel while breathing?
86.0292635998	n/a	n/a	difficult	1	4.418088499456644	10	How difficult did it feel to breath?
90.7966697002	n/a	n/a	unpleasant	1	4.724550800397992	9	How unpleasant did it feel to breathe?
95.8626667	n/a	n/a	happy	1	5.039756000041962	0	How happy or unhappy did you feel during loaded breathing?
99.9608639004	n/a	n/a	calm	1	4.074283900670707	4	How calm or excited did you feel during loaded breathing?
107.1945271	n/a	n/a	anxiety	1	7.190669199451804	9	Please indicate how much anxiety you felt while breathing.
107.2086088	n/a	n/a	n/a	99	n/a	n/a	n/a
