onset	duration	trial_type	trial_number	event_code	response_time	response	result
0.0	0	n/a	n/a	0	n/a	n/a	n/a
80.5019442001	n/a	n/a	fear	1	6.421194300055504	9	How much fear did you feel while breathing?
85.6330917003	n/a	n/a	difficult	1	5.082776200026274	9	How difficult did it feel to breath?
95.2160962	n/a	n/a	unpleasant	1	9.540093800053	9	How unpleasant did it feel to breathe?
101.5313245	n/a	n/a	happy	1	6.28864430077374	0	How happy or unhappy did you feel during loaded breathing?
110.1462124	n/a	n/a	calm	1	8.592268699780107	4	How calm or excited did you feel during loaded breathing?
116.446421	n/a	n/a	anxiety	1	6.252959200181067	9	Please indicate how much anxiety you felt while breathing.
116.4599209	n/a	n/a	n/a	99	n/a	n/a	n/a
