onset	duration	trial_type	trial_number	event_code	response_time	response	result
0.0	0	n/a	n/a	0	n/a	n/a	n/a
84.3096145	n/a	n/a	fear	1	5.490916100330651	7	How much fear did you feel while breathing?
89.1249057995	n/a	n/a	difficult	1	4.720527899451554	9	How difficult did it feel to breath?
94.2077260995	n/a	n/a	unpleasant	1	4.989023099653423	9	How unpleasant did it feel to breathe?
97.5067341998	n/a	n/a	happy	1	3.248684000223875	1	How happy or unhappy did you feel during loaded breathing?
102.022798699	n/a	n/a	calm	1	4.46867819968611	3	How calm or excited did you feel during loaded breathing?
107.5225565	n/a	n/a	anxiety	1	5.401568599976599	8	Please indicate how much anxiety you felt while breathing.
107.535425399	n/a	n/a	n/a	99	n/a	n/a	n/a
