onset	duration	trial_type	trial_number	event_code	response_time	response	result
0.0	0	n/a	n/a	0	n/a	n/a	n/a
102.4342327	n/a	n/a	fear	1	10.347135699819773	1	How much fear did you feel while breathing?
114.2681447	n/a	n/a	difficult	1	11.702546099666506	4	How difficult did it feel to breath?
120.5500611	n/a	n/a	unpleasant	1	6.16179859964177	3	How unpleasant did it feel to breathe?
127.9166184	n/a	n/a	happy	1	7.305257900152355	2	How happy or unhappy did you feel during loaded breathing?
136.6813761	n/a	n/a	calm	1	8.688730200286955	1	How calm or excited did you feel during loaded breathing?
148.0307349	n/a	n/a	anxiety	1	11.257673900108784	3	Please indicate how much anxiety you felt while breathing.
148.0415362	n/a	n/a	n/a	99	n/a	n/a	n/a
