onset	duration	trial_type	trial_number	event_code	response_time	response	result
0.0	0	n/a	n/a	0	n/a	n/a	n/a
85.6484745	n/a	n/a	fear	1	7.2953264999669045	6	How much fear did you feel while breathing?
89.7667482001	n/a	n/a	difficult	1	4.071143100038171	6	How difficult did it feel to breath?
94.7321341	n/a	n/a	unpleasant	1	4.9211323000490665	6	How unpleasant did it feel to breathe?
99.897281	n/a	n/a	happy	1	5.139388700015843	1	How happy or unhappy did you feel during loaded breathing?
109.5114289	n/a	n/a	calm	1	9.591430100030266	3	How calm or excited did you feel during loaded breathing?
115.6606575	n/a	n/a	anxiety	1	6.102857999969274	6	Please indicate how much anxiety you felt while breathing.
115.675514	n/a	n/a	n/a	99	n/a	n/a	n/a
