onset	duration	trial_type	trial_number	event_code	response_time	response	result
0.0	0	n/a	n/a	0	n/a	n/a	n/a
98.115709	n/a	n/a	fear	1	7.432408499997109	2	How much fear did you feel while breathing?
104.9316175	n/a	n/a	difficult	1	6.769308599992655	3	How difficult did it feel to breath?
112.8809382	n/a	n/a	unpleasant	1	7.901627300074324	3	How unpleasant did it feel to breathe?
119.645767	n/a	n/a	happy	1	6.73892330005765	2	How happy or unhappy did you feel during loaded breathing?
127.4447709	n/a	n/a	calm	1	7.776214299956337	2	How calm or excited did you feel during loaded breathing?
138.7932649	n/a	n/a	anxiety	1	11.297511699958704	4	Please indicate how much anxiety you felt while breathing.
138.8074528	n/a	n/a	n/a	99	n/a	n/a	n/a
