onset	duration	trial_type	trial_number	event_code	response_time	response	result
0.0	0	n/a	n/a	0	n/a	n/a	n/a
84.9008017001	n/a	n/a	fear	1	3.797658999916166	0	How much fear did you feel while breathing?
88.5172185004	n/a	n/a	difficult	1	3.568442600313574	1	How difficult did it feel to breath?
92.9328891002	n/a	n/a	unpleasant	1	4.366319200024009	1	How unpleasant did it feel to breathe?
97.1161835003	n/a	n/a	happy	1	4.151441900059581	2	How happy or unhappy did you feel during loaded breathing?
100.1825049	n/a	n/a	calm	1	3.04315169993788	1	How calm or excited did you feel during loaded breathing?
102.4647763	n/a	n/a	anxiety	1	2.23314470006153	0	Please indicate how much anxiety you felt while breathing.
102.4784711	n/a	n/a	n/a	99	n/a	n/a	n/a
