onset	duration	trial_type	trial_number	event_code	response_time	response	result
0.0	0	n/a	n/a	0	n/a	n/a	n/a
92.5672111004	n/a	n/a	fear	1	7.953027000185102	2	How much fear did you feel while breathing?
100.1004452	n/a	n/a	difficult	1	7.482323700096458	3	How difficult did it feel to breath?
103.0654908	n/a	n/a	unpleasant	1	2.913540800102055	3	How unpleasant did it feel to breathe?
106.8310305	n/a	n/a	happy	1	3.7394145000725985	1	How happy or unhappy did you feel during loaded breathing?
112.9634191	n/a	n/a	calm	1	6.108661599922925	2	How calm or excited did you feel during loaded breathing?
117.880637	n/a	n/a	anxiety	1	4.869138600304723	2	Please indicate how much anxiety you felt while breathing.
117.8935954	n/a	n/a	n/a	99	n/a	n/a	n/a
