onset	duration	trial_type	trial_number	event_code	response_time	response	result
0.0	0	n/a	n/a	0	n/a	n/a	n/a
87.3968313	n/a	n/a	fear	1	5.932971299975179	6	How much fear did you feel while breathing?
92.8301251	n/a	n/a	difficult	1	5.346755000005942	10	How difficult did it feel to breath?
97.6475573	n/a	n/a	unpleasant	1	4.725840499973856	10	How unpleasant did it feel to breathe?
102.0102774	n/a	n/a	happy	1	4.304243799997494	0	How happy or unhappy did you feel during loaded breathing?
106.8785173	n/a	n/a	calm	1	4.826187500031665	4	How calm or excited did you feel during loaded breathing?
113.0272151	n/a	n/a	anxiety	1	6.016249500040431	8	Please indicate how much anxiety you felt while breathing.
113.0390894	n/a	n/a	n/a	99	n/a	n/a	n/a
