onset	duration	trial_type	trial_number	event_code	response_time	response	result
0.0	0	n/a	n/a	0	n/a	n/a	n/a
90.2811540002	n/a	n/a	fear	1	7.705604000017047	0	How much fear did you feel while breathing?
94.9329499993	n/a	n/a	difficult	1	4.6069637993350625	4	How difficult did it feel to breath?
99.9155848995	n/a	n/a	unpleasant	1	4.935706599615514	3	How unpleasant did it feel to breathe?
104.647217	n/a	n/a	happy	1	4.706246600486338	2	How happy or unhappy did you feel during loaded breathing?
112.046176299	n/a	n/a	calm	1	7.3756243996322155	1	How calm or excited did you feel during loaded breathing?
116.546104699	n/a	n/a	anxiety	1	4.4528620997443795	2	Please indicate how much anxiety you felt while breathing.
116.5592038	n/a	n/a	n/a	99	n/a	n/a	n/a
