onset	duration	trial_type	trial_number	event_code	response_time	response	result
0.0	0	n/a	n/a	0	n/a	n/a	n/a
92.5236985004	n/a	n/a	fear	1	6.418200899846852	3	How much fear did you feel while breathing?
96.9890087005	n/a	n/a	difficult	1	4.4154685996472836	4	How difficult did it feel to breath?
99.4873231007	n/a	n/a	unpleasant	1	2.4426306998357177	4	How unpleasant did it feel to breathe?
103.4042658	n/a	n/a	happy	1	3.8867239002138376	2	How happy or unhappy did you feel during loaded breathing?
107.920179401	n/a	n/a	calm	1	4.489098000340164	1	How calm or excited did you feel during loaded breathing?
110.8530684	n/a	n/a	anxiety	1	2.8767663994804025	3	Please indicate how much anxiety you felt while breathing.
110.866521301	n/a	n/a	n/a	99	n/a	n/a	n/a
