onset	duration	trial_type	trial_number	event_code	response_time	response	result
0.0	0	n/a	n/a	0	n/a	n/a	n/a
98.0293441	n/a	n/a	fear	1	7.044392199954018	5	How much fear did you feel while breathing?
103.3088379	n/a	n/a	difficult	1	5.177142400061712	6	How difficult did it feel to breath?
108.1915859	n/a	n/a	unpleasant	1	4.771668399916962	6	How unpleasant did it feel to breathe?
114.955228	n/a	n/a	happy	1	6.70724010001868	1	How happy or unhappy did you feel during loaded breathing?
121.2038294	n/a	n/a	calm	1	6.187357399845496	3	How calm or excited did you feel during loaded breathing?
130.088381	n/a	n/a	anxiety	1	8.787959000095725	6	Please indicate how much anxiety you felt while breathing.
130.0996088	n/a	n/a	n/a	99	n/a	n/a	n/a
