onset	duration	trial_type	trial_number	event_code	response_time	response	result
0.0	0	n/a	n/a	0	n/a	n/a	n/a
81.9922411	n/a	n/a	fear	1	2.7716740000032587	5	How much fear did you feel while breathing?
86.7749648	n/a	n/a	difficult	1	4.729509899989353	8	How difficult did it feel to breath?
88.9410289	n/a	n/a	unpleasant	1	2.10907180000504	7	How unpleasant did it feel to breathe?
91.9415261	n/a	n/a	happy	1	2.968215400003828	0	How happy or unhappy did you feel during loaded breathing?
95.7076844	n/a	n/a	calm	1	3.7395289999985835	2	How calm or excited did you feel during loaded breathing?
102.9761547	n/a	n/a	anxiety	1	7.214863500004867	6	Please indicate how much anxiety you felt while breathing.
102.9865868	n/a	n/a	n/a	99	n/a	n/a	n/a
