onset	duration	trial_type	trial_number	event_code	response_time	response	result
0.0	0	n/a	n/a	0	n/a	n/a	n/a
94.4047919002	n/a	n/a	fear	1	6.68565270002	7	How much fear did you feel while breathing?
101.0228912	n/a	n/a	difficult	1	6.560259700054303	8	How difficult did it feel to breath?
108.4883677	n/a	n/a	unpleasant	1	7.409164599841461	9	How unpleasant did it feel to breathe?
118.7341769	n/a	n/a	happy	1	10.21247909986414	1	How happy or unhappy did you feel during loaded breathing?
127.0527522	n/a	n/a	calm	1	8.292661699932069	3	How calm or excited did you feel during loaded breathing?
136.4661659	n/a	n/a	anxiety	1	9.34895859984681	8	Please indicate how much anxiety you felt while breathing.
136.4805329	n/a	n/a	n/a	99	n/a	n/a	n/a
