onset	duration	trial_type	trial_number	event_code	response_time	response	result
0.0	0	n/a	n/a	0	n/a	n/a	n/a
90.8159028003	n/a	n/a	fear	1	6.018311000429094	4	How much fear did you feel while breathing?
96.316662	n/a	n/a	difficult	1	5.454335399903357	8	How difficult did it feel to breath?
101.4995236	n/a	n/a	unpleasant	1	5.133115800097585	8	How unpleasant did it feel to breathe?
106.6808041	n/a	n/a	happy	1	5.155038999859244	1	How happy or unhappy did you feel during loaded breathing?
112.1121915	n/a	n/a	calm	1	5.408243699930608	3	How calm or excited did you feel during loaded breathing?
117.9124536	n/a	n/a	anxiety	1	5.7549744001589715	7	Please indicate how much anxiety you felt while breathing.
117.9254993	n/a	n/a	n/a	99	n/a	n/a	n/a
