onset	duration	trial_type	trial_number	event_code	response_time	response	result
0.0	0	n/a	n/a	0	n/a	n/a	n/a
90.357233	n/a	n/a	fear	1	6.531833999790251	0	How much fear did you feel while breathing?
101.0387504	n/a	n/a	difficult	1	10.627513399347663	3	How difficult did it feel to breath?
112.0383185	n/a	n/a	unpleasant	1	10.944229199551046	1	How unpleasant did it feel to breathe?
116.6033685	n/a	n/a	happy	1	4.526613799855113	2	How happy or unhappy did you feel during loaded breathing?
122.635736	n/a	n/a	calm	1	6.00374039914459	0	How calm or excited did you feel during loaded breathing?
133.3522646	n/a	n/a	anxiety	1	10.656922499649227	2	Please indicate how much anxiety you felt while breathing.
133.3653052	n/a	n/a	n/a	99	n/a	n/a	n/a
