onset	duration	trial_type	trial_number	event_code	response_time	response	result
0.0	0	n/a	n/a	0	n/a	n/a	n/a
88.6087348	n/a	n/a	fear	1	7.192256500013173	3	How much fear did you feel while breathing?
97.6242996999	n/a	n/a	difficult	1	8.921011100057513	5	How difficult did it feel to breath?
104.4065819	n/a	n/a	unpleasant	1	6.689940799959004	6	How unpleasant did it feel to breathe?
114.3546503	n/a	n/a	happy	1	9.890869500115514	1	How happy or unhappy did you feel during loaded breathing?
122.0211313	n/a	n/a	calm	1	7.6255629998631775	1	How calm or excited did you feel during loaded breathing?
129.4533883	n/a	n/a	anxiety	1	7.323885099962354	4	Please indicate how much anxiety you felt while breathing.
129.4668857	n/a	n/a	n/a	99	n/a	n/a	n/a
