onset	duration	trial_type	trial_number	event_code	response_time	response	result
0.0	0	n/a	n/a	0	n/a	n/a	n/a
92.5723508	n/a	n/a	fear	1	5.977504000067711	2	How much fear did you feel while breathing?
99.6875462998	n/a	n/a	difficult	1	7.064228899776936	6	How difficult did it feel to breath?
106.1040141	n/a	n/a	unpleasant	1	6.359676999971271	5	How unpleasant did it feel to breathe?
112.168055899	n/a	n/a	happy	1	6.0282739996910095	1	How happy or unhappy did you feel during loaded breathing?
118.049631899	n/a	n/a	calm	1	5.854635299183428	2	How calm or excited did you feel during loaded breathing?
125.033412499	n/a	n/a	anxiety	1	6.9223381001502275	1	Please indicate how much anxiety you felt while breathing.
125.0464266	n/a	n/a	n/a	99	n/a	n/a	n/a
