onset	duration	trial_type	trial_number	event_code	response_time	response	result
0.0	0	n/a	n/a	0	n/a	n/a	n/a
94.9334282	n/a	n/a	fear	1	7.118875700049102	4	How much fear did you feel while breathing?
103.8992864	n/a	n/a	difficult	1	8.918739300221205	6	How difficult did it feel to breath?
113.6146094	n/a	n/a	unpleasant	1	9.667758000083268	5	How unpleasant did it feel to breathe?
124.5779399	n/a	n/a	happy	1	10.934166300110519	2	How happy or unhappy did you feel during loaded breathing?
135.4617221	n/a	n/a	calm	1	10.857857499737293	2	How calm or excited did you feel during loaded breathing?
145.543749	n/a	n/a	anxiety	1	10.029282600153238	6	Please indicate how much anxiety you felt while breathing.
145.5571033	n/a	n/a	n/a	99	n/a	n/a	n/a
