onset	duration	trial_type	trial_number	event_code	response_time	response	result
0.0	0	n/a	n/a	0	n/a	n/a	n/a
94.7838508999	n/a	n/a	fear	1	8.079336799681187	7	How much fear did you feel while breathing?
100.1491653	n/a	n/a	difficult	1	5.31219010008499	8	How difficult did it feel to breath?
106.9659771	n/a	n/a	unpleasant	1	6.754250700119883	8	How unpleasant did it feel to breathe?
112.697297	n/a	n/a	happy	1	5.697769400198013	1	How happy or unhappy did you feel during loaded breathing?
123.8291486	n/a	n/a	calm	1	11.108180799987167	3	How calm or excited did you feel during loaded breathing?
132.0949317	n/a	n/a	anxiety	1	8.213733700104058	8	Please indicate how much anxiety you felt while breathing.
132.1082794	n/a	n/a	n/a	99	n/a	n/a	n/a
