onset	duration	trial_type	trial_number	event_code	response_time	response	result
0.0	0	n/a	n/a	0	n/a	n/a	n/a
95.845471	n/a	n/a	fear	1	6.997814300004393	6	How much fear did you feel while breathing?
100.8105805	n/a	n/a	difficult	1	4.914932999992743	5	How difficult did it feel to breath?
105.0611605	n/a	n/a	unpleasant	1	4.206733600003645	5	How unpleasant did it feel to breathe?
109.5272797	n/a	n/a	happy	1	4.440590800018981	0	How happy or unhappy did you feel during loaded breathing?
119.3759098	n/a	n/a	calm	1	9.823742900014622	2	How calm or excited did you feel during loaded breathing?
123.3092573	n/a	n/a	anxiety	1	3.8871630000066943	7	Please indicate how much anxiety you felt while breathing.
123.3217901	n/a	n/a	n/a	99	n/a	n/a	n/a
