onset	duration	trial_type	trial_number	event_code	response_time	response	result
0.0	0	n/a	n/a	0	n/a	n/a	n/a
87.9884805001	n/a	n/a	fear	1	7.901767599978484	0	How much fear did you feel while breathing?
94.3049353	n/a	n/a	difficult	1	6.267069099936634	3	How difficult did it feel to breath?
101.3211058	n/a	n/a	unpleasant	1	6.9660105999791995	1	How unpleasant did it feel to breathe?
103.4208983	n/a	n/a	happy	1	2.0669280999572948	2	How happy or unhappy did you feel during loaded breathing?
109.1197008	n/a	n/a	calm	1	5.673981599975377	2	How calm or excited did you feel during loaded breathing?
116.4023373	n/a	n/a	anxiety	1	7.229961299919523	0	Please indicate how much anxiety you felt while breathing.
116.4150126	n/a	n/a	n/a	99	n/a	n/a	n/a
