onset	duration	trial_type	trial_number	event_code	response_time	response	result
0.0	0	n/a	n/a	0	n/a	n/a	n/a
77.0009275	n/a	n/a	fear	1	3.912548900116235	5	How much fear did you feel while breathing?
82.8516313001	n/a	n/a	difficult	1	5.80762240011245	9	How difficult did it feel to breath?
85.7184032002	n/a	n/a	unpleasant	1	2.824247899930924	8	How unpleasant did it feel to breathe?
90.2336912001	n/a	n/a	happy	1	4.485898000188172	0	How happy or unhappy did you feel during loaded breathing?
95.1989243999	n/a	n/a	calm	1	4.941481799818575	4	How calm or excited did you feel during loaded breathing?
99.7145461999	n/a	n/a	anxiety	1	4.471549599897116	6	Please indicate how much anxiety you felt while breathing.
99.7288075001	n/a	n/a	n/a	99	n/a	n/a	n/a
