onset	duration	trial_type	trial_number	event_code	response_time	response	result
0.0	0	n/a	n/a	0	n/a	n/a	n/a
98.2806975003	n/a	n/a	fear	1	8.93148609995842	2	How much fear did you feel while breathing?
105.8307518	n/a	n/a	difficult	1	7.502931100316346	2	How difficult did it feel to breath?
111.3130345	n/a	n/a	unpleasant	1	5.436080900020897	3	How unpleasant did it feel to breathe?
118.7447838	n/a	n/a	happy	1	7.40496729966253	2	How happy or unhappy did you feel during loaded breathing?
125.9281222	n/a	n/a	calm	1	7.1590780997648835	2	How calm or excited did you feel during loaded breathing?
134.57671	n/a	n/a	anxiety	1	8.603271599859	2	Please indicate how much anxiety you felt while breathing.
134.589679	n/a	n/a	n/a	99	n/a	n/a	n/a
