onset	duration	trial_type	trial_number	event_code	response_time	response	result
0.0	0	n/a	n/a	0	n/a	n/a	n/a
95.6981202001	n/a	n/a	fear	1	9.145515199750662	3	How much fear did you feel while breathing?
102.7790337	n/a	n/a	difficult	1	7.034660499542952	4	How difficult did it feel to breath?
108.362383001	n/a	n/a	unpleasant	1	5.536160700023174	3	How unpleasant did it feel to breathe?
115.6949827	n/a	n/a	happy	1	7.305920000188053	2	How happy or unhappy did you feel during loaded breathing?
123.5781664	n/a	n/a	calm	1	7.859036699868739	2	How calm or excited did you feel during loaded breathing?
130.6100562	n/a	n/a	anxiety	1	6.982897199690342	4	Please indicate how much anxiety you felt while breathing.
130.6235324	n/a	n/a	n/a	99	n/a	n/a	n/a
