onset	duration	trial_type	trial_number	event_code	response_time	response	result
0.0	0	n/a	n/a	0	n/a	n/a	n/a
96.5806072	n/a	n/a	fear	1	5.579671100247651	0	How much fear did you feel while breathing?
107.6126388	n/a	n/a	difficult	1	10.982668099924922	1	How difficult did it feel to breath?
112.5951495	n/a	n/a	unpleasant	1	4.933677799999714	1	How unpleasant did it feel to breathe?
118.2123329	n/a	n/a	happy	1	5.587455799803138	4	How happy or unhappy did you feel during loaded breathing?
125.8599841	n/a	n/a	calm	1	7.623317299876362	0	How calm or excited did you feel during loaded breathing?
131.9929882	n/a	n/a	anxiety	1	6.082574599888176	0	Please indicate how much anxiety you felt while breathing.
132.0072097	n/a	n/a	n/a	99	n/a	n/a	n/a
