onset	duration	trial_type	trial_number	event_code	response_time	response	result
0.0	0	n/a	n/a	0	n/a	n/a	n/a
97.7141478	n/a	n/a	fear	1	4.587868900038302	0	How much fear did you feel while breathing?
102.6802129	n/a	n/a	difficult	1	4.9223842999199405	0	How difficult did it feel to breath?
106.9295706	n/a	n/a	unpleasant	1	4.201451999950223	0	How unpleasant did it feel to breathe?
113.6950926	n/a	n/a	happy	1	6.739854900049977	4	How happy or unhappy did you feel during loaded breathing?
118.7777341	n/a	n/a	calm	1	5.06077219999861	0	How calm or excited did you feel during loaded breathing?
124.2609327	n/a	n/a	anxiety	1	5.437342400080524	0	Please indicate how much anxiety you felt while breathing.
124.274226	n/a	n/a	n/a	99	n/a	n/a	n/a
