onset	duration	trial_type	trial_number	event_code	response_time	response	result
0.0	0	n/a	n/a	0	n/a	n/a	n/a
92.8220956996	n/a	n/a	fear	1	2.964928198605776	0	How much fear did you feel while breathing?
99.6545083001	n/a	n/a	difficult	1	6.782297799363732	4	How difficult did it feel to breath?
104.553686401	n/a	n/a	unpleasant	1	4.846811899915338	1	How unpleasant did it feel to breathe?
107.0032908	n/a	n/a	happy	1	2.4200547002255917	2	How happy or unhappy did you feel during loaded breathing?
110.4528623	n/a	n/a	calm	1	3.4253855999559164	2	How calm or excited did you feel during loaded breathing?
118.152848	n/a	n/a	anxiety	1	7.6502151992172	0	Please indicate how much anxiety you felt while breathing.
118.1662916	n/a	n/a	n/a	99	n/a	n/a	n/a
