onset	duration	trial_type	trial_number	event_code	response_time	response	result
0.0	0	n/a	n/a	0	n/a	n/a	n/a
92.8449288998	n/a	n/a	fear	1	4.152960700914264	0	How much fear did you feel while breathing?
99.5608831998	n/a	n/a	difficult	1	6.667232999578118	2	How difficult did it feel to breath?
103.727468299	n/a	n/a	unpleasant	1	4.114946499466896	1	How unpleasant did it feel to breathe?
106.576486299	n/a	n/a	happy	1	2.8182089999318123	2	How happy or unhappy did you feel during loaded breathing?
110.0253285	n/a	n/a	calm	1	3.4244867004454136	2	How calm or excited did you feel during loaded breathing?
112.942303099	n/a	n/a	anxiety	1	2.8663918990641832	0	Please indicate how much anxiety you felt while breathing.
112.956770999	n/a	n/a	n/a	99	n/a	n/a	n/a
