onset	duration	trial_type	trial_number	event_code	response_time	response	result
0.0	0	n/a	n/a	0	n/a	n/a	n/a
96.6159893996	n/a	n/a	fear	1	6.6010023998096585	4	How much fear did you feel while breathing?
105.1331586	n/a	n/a	difficult	1	8.470708600245416	5	How difficult did it feel to breath?
111.0490301	n/a	n/a	unpleasant	1	5.870892600156367	5	How unpleasant did it feel to breathe?
118.0472067	n/a	n/a	happy	1	6.971708199940622	2	How happy or unhappy did you feel during loaded breathing?
127.0458067	n/a	n/a	calm	1	8.974186700303108	2	How calm or excited did you feel during loaded breathing?
134.7130874	n/a	n/a	anxiety	1	7.618149800226092	5	Please indicate how much anxiety you felt while breathing.
134.7248138	n/a	n/a	n/a	99	n/a	n/a	n/a
