onset	duration	trial_type	trial_number	event_code	response_time	response	result
0.0	0	n/a	n/a	0	n/a	n/a	n/a
86.1788769001	n/a	n/a	fear	1	4.733518600463867	1	How much fear did you feel while breathing?
89.7273797002	n/a	n/a	difficult	1	3.465409600175917	6	How difficult did it feel to breath?
93.6104637999	n/a	n/a	unpleasant	1	3.7861604001373053	5	How unpleasant did it feel to breathe?
98.3766411999	n/a	n/a	happy	1	4.703476400114596	1	How happy or unhappy did you feel during loaded breathing?
103.408088299	n/a	n/a	calm	1	4.981669100001454	3	How calm or excited did you feel during loaded breathing?
109.4253692	n/a	n/a	anxiety	1	5.927396600134671	4	Please indicate how much anxiety you felt while breathing.
109.4369466	n/a	n/a	n/a	99	n/a	n/a	n/a
