onset	duration	trial_type	trial_number	event_code	response_time	response	result
0.0	0	n/a	n/a	0	n/a	n/a	n/a
91.7027191001	n/a	n/a	fear	1	9.599094700068235	5	How much fear did you feel while breathing?
100.1686745	n/a	n/a	difficult	1	8.417713199974969	5	How difficult did it feel to breath?
108.2680128	n/a	n/a	unpleasant	1	8.05118179996498	6	How unpleasant did it feel to breathe?
115.5497044	n/a	n/a	happy	1	7.252931300085038	2	How happy or unhappy did you feel during loaded breathing?
122.9331038	n/a	n/a	calm	1	7.358145199948922	2	How calm or excited did you feel during loaded breathing?
130.4650801	n/a	n/a	anxiety	1	7.484050299972296	6	Please indicate how much anxiety you felt while breathing.
130.4789269	n/a	n/a	n/a	99	n/a	n/a	n/a
