onset	duration	trial_type	trial_number	event_code	response_time	response	result
0.0	0	n/a	n/a	0	n/a	n/a	n/a
91.0951108001	n/a	n/a	fear	1	8.63152480009012	6	How much fear did you feel while breathing?
97.2438337	n/a	n/a	difficult	1	6.09913820005022	6	How difficult did it feel to breath?
103.3439435	n/a	n/a	unpleasant	1	6.046967499889433	6	How unpleasant did it feel to breathe?
108.8252324	n/a	n/a	happy	1	5.4520001001656055	2	How happy or unhappy did you feel during loaded breathing?
117.8576488	n/a	n/a	calm	1	9.008437799988315	2	How calm or excited did you feel during loaded breathing?
123.8582649	n/a	n/a	anxiety	1	5.9455921000335366	6	Please indicate how much anxiety you felt while breathing.
123.8715989	n/a	n/a	n/a	99	n/a	n/a	n/a
