onset	duration	trial_type	trial_number	event_code	response_time	response	result
0.0	0	n/a	n/a	0	n/a	n/a	n/a
82.4509414001	n/a	n/a	fear	1	4.580488699954003	0	How much fear did you feel while breathing?
85.7339381003	n/a	n/a	difficult	1	3.239284100010991	5	How difficult did it feel to breath?
89.0672058002	n/a	n/a	unpleasant	1	3.289992699865252	5	How unpleasant did it feel to breathe?
90.9165066001	n/a	n/a	happy	1	1.8247540998272598	3	How happy or unhappy did you feel during loaded breathing?
93.6823098003	n/a	n/a	calm	1	2.7421439001336694	1	How calm or excited did you feel during loaded breathing?
97.1668263003	n/a	n/a	anxiety	1	3.439954100176692	0	Please indicate how much anxiety you felt while breathing.
97.1788065	n/a	n/a	n/a	99	n/a	n/a	n/a
