onset	duration	trial_type	trial_number	event_code	response_time	response	result
0.0	0	n/a	n/a	0	n/a	n/a	n/a
91.2889965	n/a	n/a	fear	1	5.493829200044274	6	How much fear did you feel while breathing?
98.2877349993	n/a	n/a	difficult	1	6.916024899110198	7	How difficult did it feel to breath?
103.2534376	n/a	n/a	unpleasant	1	4.868322100490332	6	How unpleasant did it feel to breathe?
109.5021934	n/a	n/a	happy	1	6.187315999530256	0	How happy or unhappy did you feel during loaded breathing?
121.5511427	n/a	n/a	calm	1	11.99222410004586	3	How calm or excited did you feel during loaded breathing?
128.367055399	n/a	n/a	anxiety	1	6.730552199296653	6	Please indicate how much anxiety you felt while breathing.
128.3784146	n/a	n/a	n/a	99	n/a	n/a	n/a
