onset	duration	trial_type	trial_number	event_code	response_time	response	result
0.0	0	n/a	n/a	0	n/a	n/a	n/a
90.1085248999	n/a	n/a	fear	1	4.441962500102818	3	How much fear did you feel while breathing?
96.6745866998	n/a	n/a	difficult	1	6.464139400050044	7	How difficult did it feel to breath?
102.8233038	n/a	n/a	unpleasant	1	6.044263600371778	6	How unpleasant did it feel to breathe?
108.1062526	n/a	n/a	happy	1	5.2240384998731315	3	How happy or unhappy did you feel during loaded breathing?
114.5581066	n/a	n/a	calm	1	6.40590659994632	2	How calm or excited did you feel during loaded breathing?
121.0719801	n/a	n/a	anxiety	1	6.410744200460613	4	Please indicate how much anxiety you felt while breathing.
121.0831547	n/a	n/a	n/a	99	n/a	n/a	n/a
