onset	duration	trial_type	trial_number	event_code	response_time	response	result
0.0	0	n/a	n/a	0	n/a	n/a	n/a
90.0436906004	n/a	n/a	fear	1	6.196831800043583	3	How much fear did you feel while breathing?
95.5263851001	n/a	n/a	difficult	1	5.394204800017178	6	How difficult did it feel to breath?
101.626338	n/a	n/a	unpleasant	1	5.997336000204086	4	How unpleasant did it feel to breathe?
107.0094182	n/a	n/a	happy	1	5.329290200024843	3	How happy or unhappy did you feel during loaded breathing?
112.123647	n/a	n/a	calm	1	5.054652399849147	2	How calm or excited did you feel during loaded breathing?
119.7738385	n/a	n/a	anxiety	1	7.557258799672127	4	Please indicate how much anxiety you felt while breathing.
119.7854191	n/a	n/a	n/a	99	n/a	n/a	n/a
