onset	duration	trial_type	trial_number	event_code	response_time	response	result
0.0	0	n/a	n/a	0	n/a	n/a	n/a
89.508097	n/a	n/a	fear	1	5.471256599761546	1	How much fear did you feel while breathing?
95.4077581	n/a	n/a	difficult	1	5.814980999566615	3	How difficult did it feel to breath?
99.5573717002	n/a	n/a	unpleasant	1	4.057252900209278	2	How unpleasant did it feel to breathe?
105.1382685	n/a	n/a	happy	1	5.518683900125325	3	How happy or unhappy did you feel during loaded breathing?
110.8380648	n/a	n/a	calm	1	5.659775899723172	1	How calm or excited did you feel during loaded breathing?
116.671958	n/a	n/a	anxiety	1	5.736355300061405	1	Please indicate how much anxiety you felt while breathing.
116.6841814	n/a	n/a	n/a	99	n/a	n/a	n/a
