onset	duration	trial_type	trial_number	event_code	response_time	response	result
0.0	0	n/a	n/a	0	n/a	n/a	n/a
88.9148398	n/a	n/a	fear	1	6.799982599914074	3	How much fear did you feel while breathing?
96.2139884001	n/a	n/a	difficult	1	7.2503570998087525	9	How difficult did it feel to breath?
101.4812845	n/a	n/a	unpleasant	1	5.217768299859017	10	How unpleasant did it feel to breathe?
110.8132	n/a	n/a	happy	1	9.303713300265372	1	How happy or unhappy did you feel during loaded breathing?
118.6115648	n/a	n/a	calm	1	7.773708099965006	3	How calm or excited did you feel during loaded breathing?
124.3286222	n/a	n/a	anxiety	1	5.665507100056857	9	Please indicate how much anxiety you felt while breathing.
124.3416592	n/a	n/a	n/a	99	n/a	n/a	n/a
