onset	duration	trial_type	trial_number	event_code	response_time	response	result
0.0	0	n/a	n/a	0	n/a	n/a	n/a
107.1292981	n/a	n/a	fear	1	9.193981199990958	5	How much fear did you feel while breathing?
114.5144429	n/a	n/a	difficult	1	7.336606199853122	7	How difficult did it feel to breath?
128.2284302	n/a	n/a	unpleasant	1	13.661038300022483	6	How unpleasant did it feel to breathe?
137.3429188	n/a	n/a	happy	1	9.082916900049895	1	How happy or unhappy did you feel during loaded breathing?
144.2418702	n/a	n/a	calm	1	6.8731062998995185	3	How calm or excited did you feel during loaded breathing?
152.1254837	n/a	n/a	anxiety	1	7.833087099716067	6	Please indicate how much anxiety you felt while breathing.
152.1381778	n/a	n/a	n/a	99	n/a	n/a	n/a
