onset	duration	trial_type	trial_number	event_code	response_time	response	result
0.0	0	n/a	n/a	0	n/a	n/a	n/a
93.9147926001	n/a	n/a	fear	1	10.352137099951506	3	How much fear did you feel while breathing?
100.4639233	n/a	n/a	difficult	1	6.500591999851167	4	How difficult did it feel to breath?
107.896472	n/a	n/a	unpleasant	1	7.383966600056738	3	How unpleasant did it feel to breathe?
114.2959548	n/a	n/a	happy	1	6.3698792001232505	1	How happy or unhappy did you feel during loaded breathing?
125.077377	n/a	n/a	calm	1	10.759275799617171	2	How calm or excited did you feel during loaded breathing?
134.7093244	n/a	n/a	anxiety	1	9.581666399724782	3	Please indicate how much anxiety you felt while breathing.
134.7224167	n/a	n/a	n/a	99	n/a	n/a	n/a
