onset	duration	trial_type	trial_number	event_code	response_time	response	result
0.0	0	n/a	n/a	0	n/a	n/a	n/a
95.4445538999	n/a	n/a	fear	1	7.012736800010316	5	How much fear did you feel while breathing?
100.9492568	n/a	n/a	difficult	1	5.394824500079267	7	How difficult did it feel to breath?
106.5311424	n/a	n/a	unpleasant	1	5.478772300062701	6	How unpleasant did it feel to breathe?
113.4261909	n/a	n/a	happy	1	6.834129599970765	3	How happy or unhappy did you feel during loaded breathing?
120.9767662	n/a	n/a	calm	1	7.507905200007372	1	How calm or excited did you feel during loaded breathing?
124.9923005	n/a	n/a	anxiety	1	3.9165480999508873	7	Please indicate how much anxiety you felt while breathing.
125.0059278	n/a	n/a	n/a	99	n/a	n/a	n/a
