onset	duration	trial_type	trial_number	event_code	response_time	response	result
0.0	0	n/a	n/a	0	n/a	n/a	n/a
93.5384106	n/a	n/a	fear	1	11.371349399967585	1	How much fear did you feel while breathing?
101.1223029	n/a	n/a	difficult	1	7.51993130001938	2	How difficult did it feel to breath?
107.1385523	n/a	n/a	unpleasant	1	5.955963500018697	2	How unpleasant did it feel to breathe?
115.08541	n/a	n/a	happy	1	7.913632399984635	3	How happy or unhappy did you feel during loaded breathing?
121.9189484	n/a	n/a	calm	1	6.800257100025192	1	How calm or excited did you feel during loaded breathing?
130.1185411	n/a	n/a	anxiety	1	8.145211800001562	1	Please indicate how much anxiety you felt while breathing.
130.1313502	n/a	n/a	n/a	99	n/a	n/a	n/a
