onset	duration	trial_type	trial_number	event_code	response_time	response	result
0.0	0	n/a	n/a	0	n/a	n/a	n/a
86.2180583002	n/a	n/a	fear	1	5.954983500298113	10	How much fear did you feel while breathing?
91.8988758	n/a	n/a	difficult	1	5.63426009984687	10	How difficult did it feel to breath?
97.415674	n/a	n/a	unpleasant	1	5.468764599878341	10	How unpleasant did it feel to breathe?
100.0640168	n/a	n/a	happy	1	2.6172271999530494	0	How happy or unhappy did you feel during loaded breathing?
106.0976405	n/a	n/a	calm	1	6.0080540999770164	4	How calm or excited did you feel during loaded breathing?
110.9471657	n/a	n/a	anxiety	1	4.801262500230223	10	Please indicate how much anxiety you felt while breathing.
110.9613644	n/a	n/a	n/a	99	n/a	n/a	n/a
