onset	duration	trial_type	trial_number	event_code	response_time	response	result
0.0	0	n/a	n/a	0	n/a	n/a	n/a
89.7675629999	n/a	n/a	fear	1	6.554787099827081	8	How much fear did you feel while breathing?
94.5168683999	n/a	n/a	difficult	1	4.702770700212568	8	How difficult did it feel to breath?
100.300356	n/a	n/a	unpleasant	1	5.739792100153863	9	How unpleasant did it feel to breathe?
106.4808907	n/a	n/a	happy	1	6.151136300060898	0	How happy or unhappy did you feel during loaded breathing?
111.3974919	n/a	n/a	calm	1	4.891828800085932	3	How calm or excited did you feel during loaded breathing?
117.9802264	n/a	n/a	anxiety	1	6.538522399961948	9	Please indicate how much anxiety you felt while breathing.
117.9942991	n/a	n/a	n/a	99	n/a	n/a	n/a
