onset	duration	trial_type	trial_number	event_code	response_time	response	result
0.0	0	n/a	n/a	0	n/a	n/a	n/a
85.962476	n/a	n/a	fear	1	4.088253599999007	0	How much fear did you feel while breathing?
90.7784695	n/a	n/a	difficult	1	4.720462800003588	1	How difficult did it feel to breath?
95.3950356	n/a	n/a	unpleasant	1	4.5269872000208125	1	How unpleasant did it feel to breathe?
97.1441736	n/a	n/a	happy	1	1.6959163999999873	1	How happy or unhappy did you feel during loaded breathing?
102.7272392	n/a	n/a	calm	1	5.519962800026406	0	How calm or excited did you feel during loaded breathing?
106.5777052	n/a	n/a	anxiety	1	3.755704399984097	0	Please indicate how much anxiety you felt while breathing.
106.5877971	n/a	n/a	n/a	99	n/a	n/a	n/a
