onset	duration	trial_type	trial_number	event_code	response_time	response	result
0.0	0	n/a	n/a	0	n/a	n/a	n/a
85.3949933	n/a	n/a	fear	1	4.558211199997459	1	How much fear did you feel while breathing?
89.9105915	n/a	n/a	difficult	1	4.422472899983404	4	How difficult did it feel to breath?
93.5451191	n/a	n/a	unpleasant	1	3.5353354000253603	2	How unpleasant did it feel to breathe?
98.0588411	n/a	n/a	happy	1	4.4574061000021175	2	How happy or unhappy did you feel during loaded breathing?
100.6757315	n/a	n/a	calm	1	2.5677550999971572	1	How calm or excited did you feel during loaded breathing?
104.9782151	n/a	n/a	anxiety	1	4.18771860000561	1	Please indicate how much anxiety you felt while breathing.
104.988364	n/a	n/a	n/a	99	n/a	n/a	n/a
