onset	duration	trial_type	trial_number	event_code	response_time	response	result
0.0	0	n/a	n/a	0	n/a	n/a	n/a
89.7195755998	n/a	n/a	fear	1	5.911966199986637	7	How much fear did you feel while breathing?
93.0846048999	n/a	n/a	difficult	1	3.3201780999079347	6	How difficult did it feel to breath?
98.1663168999	n/a	n/a	unpleasant	1	5.038142499979585	8	How unpleasant did it feel to breathe?
103.7498807	n/a	n/a	happy	1	5.556544800288975	1	How happy or unhappy did you feel during loaded breathing?
108.7483327	n/a	n/a	calm	1	4.97678739996627	3	How calm or excited did you feel during loaded breathing?
115.7146667	n/a	n/a	anxiety	1	6.920645600184798	8	Please indicate how much anxiety you felt while breathing.
115.7293088	n/a	n/a	n/a	99	n/a	n/a	n/a
