onset	duration	trial_type	trial_number	event_code	response_time	response	result
0.0	0	n/a	n/a	0	n/a	n/a	n/a
89.0869030003	n/a	n/a	fear	1	5.602430200204253	1	How much fear did you feel while breathing?
94.8838424999	n/a	n/a	difficult	1	5.751409899909049	2	How difficult did it feel to breath?
101.0344804	n/a	n/a	unpleasant	1	6.1063176998868585	1	How unpleasant did it feel to breathe?
107.7509114	n/a	n/a	happy	1	6.6886889999732375	3	How happy or unhappy did you feel during loaded breathing?
114.9988471	n/a	n/a	calm	1	7.223888199776411	0	How calm or excited did you feel during loaded breathing?
122.1145946	n/a	n/a	anxiety	1	7.069156700279564	1	Please indicate how much anxiety you felt while breathing.
122.1287633	n/a	n/a	n/a	99	n/a	n/a	n/a
