onset	duration	trial_type	trial_number	event_code	response_time	response	result
0.0	0	n/a	n/a	0	n/a	n/a	n/a
95.3262331001	n/a	n/a	fear	1	8.682728399522603	2	How much fear did you feel while breathing?
99.4925964	n/a	n/a	difficult	1	4.119925499893725	3	How difficult did it feel to breath?
104.525805701	n/a	n/a	unpleasant	1	4.988230200484395	3	How unpleasant did it feel to breathe?
111.306868601	n/a	n/a	happy	1	6.754648300819099	2	How happy or unhappy did you feel during loaded breathing?
116.8241719	n/a	n/a	calm	1	5.494681399315596	2	How calm or excited did you feel during loaded breathing?
122.5241518	n/a	n/a	anxiety	1	5.650591500103474	3	Please indicate how much anxiety you felt while breathing.
122.5369352	n/a	n/a	n/a	99	n/a	n/a	n/a
