onset	duration	trial_type	trial_number	event_code	response_time	response	result
0.0	0	n/a	n/a	0	n/a	n/a	n/a
97.6070330003	n/a	n/a	fear	1	11.97347309999168	4	How much fear did you feel while breathing?
104.3061095	n/a	n/a	difficult	1	6.65197669994086	3	How difficult did it feel to breath?
113.270794201	n/a	n/a	unpleasant	1	8.917125000618398	4	How unpleasant did it feel to breathe?
120.2702975	n/a	n/a	happy	1	6.971922799944878	1	How happy or unhappy did you feel during loaded breathing?
134.734615101	n/a	n/a	calm	1	14.439693399704993	1	How calm or excited did you feel during loaded breathing?
141.984349401	n/a	n/a	anxiety	1	7.200787399895489	4	Please indicate how much anxiety you felt while breathing.
141.9985897	n/a	n/a	n/a	99	n/a	n/a	n/a
