onset	duration	trial_type	trial_number	event_code	response_time	response	result
0.0	0	n/a	n/a	0	n/a	n/a	n/a
107.1298619	n/a	n/a	fear	1	7.79566820000764	7	How much fear did you feel while breathing?
112.7958892	n/a	n/a	difficult	1	5.612357500009239	7	How difficult did it feel to breath?
117.7783849	n/a	n/a	unpleasant	1	4.9339534000027925	7	How unpleasant did it feel to breathe?
124.2771157	n/a	n/a	happy	1	6.469792499905452	0	How happy or unhappy did you feel during loaded breathing?
130.9594949	n/a	n/a	calm	1	6.65729270002339	4	How calm or excited did you feel during loaded breathing?
136.7599866	n/a	n/a	anxiety	1	5.750438700080849	7	Please indicate how much anxiety you felt while breathing.
136.77257	n/a	n/a	n/a	99	n/a	n/a	n/a
