onset	duration	trial_type	trial_number	event_code	response_time	response	result
0.0	0	n/a	n/a	0	n/a	n/a	n/a
99.2919196002	n/a	n/a	fear	1	9.489535899832845	0	How much fear did you feel while breathing?
106.9566887	n/a	n/a	difficult	1	7.619705100543797	7	How difficult did it feel to breath?
111.9573677	n/a	n/a	unpleasant	1	4.953718899749219	6	How unpleasant did it feel to breathe?
119.6539143	n/a	n/a	happy	1	7.670853899791837	2	How happy or unhappy did you feel during loaded breathing?
130.1713447	n/a	n/a	calm	1	10.494256700389087	1	How calm or excited did you feel during loaded breathing?
137.3707652	n/a	n/a	anxiety	1	7.1517700999975204	1	Please indicate how much anxiety you felt while breathing.
137.3831975	n/a	n/a	n/a	99	n/a	n/a	n/a
