onset	duration	trial_type	trial_number	event_code	response_time	response	result
0.0	0	n/a	n/a	0	n/a	n/a	n/a
95.3770631002	n/a	n/a	fear	1	8.36682050023228	6	How much fear did you feel while breathing?
101.161951001	n/a	n/a	difficult	1	5.739092200063169	10	How difficult did it feel to breath?
108.9615909	n/a	n/a	unpleasant	1	7.753793799318373	10	How unpleasant did it feel to breathe?
116.6422161	n/a	n/a	happy	1	7.653418799862266	0	How happy or unhappy did you feel during loaded breathing?
123.641849901	n/a	n/a	calm	1	6.975451400503516	2	How calm or excited did you feel during loaded breathing?
130.925482	n/a	n/a	anxiety	1	7.236967300064862	9	Please indicate how much anxiety you felt while breathing.
130.9378981	n/a	n/a	n/a	99	n/a	n/a	n/a
