onset	duration	trial_type	trial_number	event_code	response_time	response	result
0.0	0	n/a	n/a	0	n/a	n/a	n/a
89.1121582994	n/a	n/a	fear	1	8.282504700124264	7	How much fear did you feel while breathing?
97.1614007	n/a	n/a	difficult	1	7.940838200040162	9	How difficult did it feel to breath?
103.0775575	n/a	n/a	unpleasant	1	5.799319799989462	8	How unpleasant did it feel to breathe?
109.792745099	n/a	n/a	happy	1	6.650677999481559	1	How happy or unhappy did you feel during loaded breathing?
116.5750305	n/a	n/a	calm	1	6.732058200053871	3	How calm or excited did you feel during loaded breathing?
123.0750474	n/a	n/a	anxiety	1	6.406482200138271	9	Please indicate how much anxiety you felt while breathing.
123.086474599	n/a	n/a	n/a	99	n/a	n/a	n/a
