onset	duration	trial_type	trial_number	event_code	response_time	response	result
0.0	0	n/a	n/a	0	n/a	n/a	n/a
85.5847748001	n/a	n/a	fear	1	6.465875099878758	4	How much fear did you feel while breathing?
90.3164923	n/a	n/a	difficult	1	4.687633699737489	4	How difficult did it feel to breath?
94.5160815003	n/a	n/a	unpleasant	1	4.153793600387871	4	How unpleasant did it feel to breathe?
100.9981688	n/a	n/a	happy	1	6.454698999878019	2	How happy or unhappy did you feel during loaded breathing?
107.86399	n/a	n/a	calm	1	6.844869900029153	2	How calm or excited did you feel during loaded breathing?
112.8138605	n/a	n/a	anxiety	1	4.904973600059748	4	Please indicate how much anxiety you felt while breathing.
112.8281706	n/a	n/a	n/a	99	n/a	n/a	n/a
