onset	duration	trial_type	trial_number	event_code	response_time	response	result
0.0	0	n/a	n/a	0	n/a	n/a	n/a
86.4332818002	n/a	n/a	fear	1	7.314015000127256	2	How much fear did you feel while breathing?
90.9158951999	n/a	n/a	difficult	1	4.43830159958452	3	How difficult did it feel to breath?
97.5482363999	n/a	n/a	unpleasant	1	6.591403799597174	3	How unpleasant did it feel to breathe?
103.797097	n/a	n/a	happy	1	6.220801500137895	2	How happy or unhappy did you feel during loaded breathing?
107.6319262	n/a	n/a	calm	1	3.8115397999063134	1	How calm or excited did you feel during loaded breathing?
113.9294726	n/a	n/a	anxiety	1	6.254181100055575	4	Please indicate how much anxiety you felt while breathing.
113.9442198	n/a	n/a	n/a	99	n/a	n/a	n/a
