onset	duration	trial_type	trial_number	event_code	response_time	response	result
0.0	0	n/a	n/a	0	n/a	n/a	n/a
96.1496990999	n/a	n/a	fear	1	6.659402700024657	5	How much fear did you feel while breathing?
104.6146551	n/a	n/a	difficult	1	8.415942699997686	7	How difficult did it feel to breath?
110.0146627	n/a	n/a	unpleasant	1	5.350450100027956	6	How unpleasant did it feel to breathe?
118.3464519	n/a	n/a	happy	1	8.301638299948536	1	How happy or unhappy did you feel during loaded breathing?
126.3279986	n/a	n/a	calm	1	7.957164500025101	1	How calm or excited did you feel during loaded breathing?
141.2777549	n/a	n/a	anxiety	1	14.900046699913219	6	Please indicate how much anxiety you felt while breathing.
141.289907	n/a	n/a	n/a	99	n/a	n/a	n/a
