onset	duration	trial_type	trial_number	event_code	response_time	response	result
0.0	0	n/a	n/a	0	n/a	n/a	n/a
93.2978818	n/a	n/a	fear	1	5.840227600070648	6	How much fear did you feel while breathing?
98.8481052	n/a	n/a	difficult	1	5.5024950000224635	8	How difficult did it feel to breath?
103.6973013	n/a	n/a	unpleasant	1	4.799681599950418	7	How unpleasant did it feel to breathe?
109.9957965	n/a	n/a	happy	1	6.269022100022994	1	How happy or unhappy did you feel during loaded breathing?
115.2439014	n/a	n/a	calm	1	5.2223694999702275	1	How calm or excited did you feel during loaded breathing?
127.3615312	n/a	n/a	anxiety	1	12.068529600044712	8	Please indicate how much anxiety you felt while breathing.
127.3734934	n/a	n/a	n/a	99	n/a	n/a	n/a
