onset	duration	trial_type	trial_number	event_code	response_time	response	result
0.0	0	n/a	n/a	0	n/a	n/a	n/a
88.7309864	n/a	n/a	fear	1	5.519142199947964	2	How much fear did you feel while breathing?
94.481834	n/a	n/a	difficult	1	5.666266100015491	8	How difficult did it feel to breath?
100.9808273	n/a	n/a	unpleasant	1	6.405835499987006	8	How unpleasant did it feel to breathe?
104.4477466	n/a	n/a	happy	1	3.4089292000280693	1	How happy or unhappy did you feel during loaded breathing?
110.5450919	n/a	n/a	calm	1	6.0498668999644	3	How calm or excited did you feel during loaded breathing?
116.2296236	n/a	n/a	anxiety	1	5.597488800005522	4	Please indicate how much anxiety you felt while breathing.
116.2410796	n/a	n/a	n/a	99	n/a	n/a	n/a
