onset	duration	trial_type	trial_number	event_code	response_time	response	result
0.0	0	n/a	n/a	0	n/a	n/a	n/a
93.7934614	n/a	n/a	fear	1	7.420027899963316	1	How much fear did you feel while breathing?
99.4937284	n/a	n/a	difficult	1	5.612487900012638	7	How difficult did it feel to breath?
105.5391814	n/a	n/a	unpleasant	1	5.955836499982979	6	How unpleasant did it feel to breathe?
109.1735878	n/a	n/a	happy	1	3.5862816000008024	1	How happy or unhappy did you feel during loaded breathing?
115.0059465	n/a	n/a	calm	1	5.780673300032504	3	How calm or excited did you feel during loaded breathing?
121.1382642	n/a	n/a	anxiety	1	6.040113700029906	3	Please indicate how much anxiety you felt while breathing.
121.1511459	n/a	n/a	n/a	99	n/a	n/a	n/a
