onset	duration	trial_type	trial_number	event_code	response_time	response	result
0.0	0	n/a	n/a	0	n/a	n/a	n/a
107.6605174	n/a	n/a	fear	1	10.75905349990353	5	How much fear did you feel while breathing?
119.0593319	n/a	n/a	difficult	1	11.351877000066452	10	How difficult did it feel to breath?
127.0410165	n/a	n/a	unpleasant	1	7.934497200069018	10	How unpleasant did it feel to breathe?
141.7893836	n/a	n/a	happy	1	14.718444199999794	4	How happy or unhappy did you feel during loaded breathing?
154.5539282	n/a	n/a	calm	1	12.740455099963583	4	How calm or excited did you feel during loaded breathing?
163.7379144	n/a	n/a	anxiety	1	9.135513699962758	9	Please indicate how much anxiety you felt while breathing.
163.7510216	n/a	n/a	n/a	99	n/a	n/a	n/a
