onset	duration	trial_type	trial_number	event_code	response_time	response	result
0.0	0	n/a	n/a	0	n/a	n/a	n/a
83.1811620001	n/a	n/a	fear	1	5.421364800073206	0	How much fear did you feel while breathing?
92.7809556	n/a	n/a	difficult	1	9.554140500025824	9	How difficult did it feel to breath?
100.3800703	n/a	n/a	unpleasant	1	7.553627399960533	9	How unpleasant did it feel to breathe?
107.0958006	n/a	n/a	happy	1	6.6894164000405	2	How happy or unhappy did you feel during loaded breathing?
113.0602745	n/a	n/a	calm	1	5.940107500064187	2	How calm or excited did you feel during loaded breathing?
120.8942897	n/a	n/a	anxiety	1	7.7851349000120535	1	Please indicate how much anxiety you felt while breathing.
120.9077515	n/a	n/a	n/a	99	n/a	n/a	n/a
