onset	duration	trial_type	trial_number	event_code	response_time	response	result
0.0	0	n/a	n/a	0	n/a	n/a	n/a
129.087377001	n/a	n/a	fear	1	5.6017068000510335	0	How much fear did you feel while breathing?
134.3524678	n/a	n/a	difficult	1	5.208856000564992	1	How difficult did it feel to breath?
141.302622	n/a	n/a	unpleasant	1	6.894616999663413	0	How unpleasant did it feel to breathe?
147.1668788	n/a	n/a	happy	1	5.832474399358034	3	How happy or unhappy did you feel during loaded breathing?
152.099699601	n/a	n/a	calm	1	4.900773100554943	0	How calm or excited did you feel during loaded breathing?
159.2998609	n/a	n/a	anxiety	1	7.145959299989045	0	Please indicate how much anxiety you felt while breathing.
159.3129604	n/a	n/a	n/a	99	n/a	n/a	n/a
