onset	duration	trial_type	trial_number	event_code	response_time	response	result
0.0	0	n/a	n/a	0	n/a	n/a	n/a
86.3173233997	n/a	n/a	fear	1	5.905628699809313	6	How much fear did you feel while breathing?
91.5987809999	n/a	n/a	difficult	1	5.223031899891794	7	How difficult did it feel to breath?
97.4132869998	n/a	n/a	unpleasant	1	5.760697700083256	6	How unpleasant did it feel to breathe?
99.9959532004	n/a	n/a	happy	1	2.550162300467491	1	How happy or unhappy did you feel during loaded breathing?
102.5963958	n/a	n/a	calm	1	2.5736386999487877	3	How calm or excited did you feel during loaded breathing?
105.7795634	n/a	n/a	anxiety	1	3.1278590001165867	6	Please indicate how much anxiety you felt while breathing.
105.793226101	n/a	n/a	n/a	99	n/a	n/a	n/a
